Judul_Artikel,,,Link_Artikel,,,,,,Isi_Artikel
Dampak Instagram Terhadap Kesehatan Mental Remaja,,,https://www.halodoc.com/artikel/dampak-instagram-terhadap-kesehatan-mental-remaja-1,,,,,,"Belakangan ini, kesehatan mental yang terjaga seolah menjadi hal yang mahal dan sulit untuk didapatkan bagi sebagian orang. Ada banyak faktor yang memengaruhi, salah satunya penggunaan media sosial dalam kehidupan sehari-hari. Semakin beragam jenis media sosial berbanding lurus dengan risiko gangguan kesehatan mental yang mungkin dialami. Remaja menjadi salah satu kelompok yang disebut paling rentan mengalami gangguan mental akibat penggunaan media sosial, misalnya Instagram. Baru-baru ini, sebuah penelitian terhadapa dokumen internal Facebook yang ditinjau oleh The Wall Street Journal menemukan bahwa penggunaan Instagram berdampak negatif pada kesehatan mental remaja putri. Gangguan kesehatan mental akibat penggunaan media sosial Instagram tengah menjadi sorotan. Ironisnya, perusahaan dan orang-orang di balik salah satu aplikasi populer itu ternyata mengetahui fakta tersebut. Salah satu masalah mental yang menjadi sorotan adalah dampak body image atau penggambaran kondisi fisik tertentu yang membuat tidak sedikit remaja perempuan merasa tidak nyaman dengan dirinya sendiri. Hal tersebut kemudian berujung pada kebiasaan membandingkan diri sendiri dengan orang lain, merasa diri tidak aman alias insecure, hingga rela melakukan apapun demi mencapai bentuk tubuh atau penggambaran fisik sesuai dengan “standar” yang ada, dan Instagram disebut membuat fenomena itu menjadi lebih buruk. Hal ini bahkan juga dikaitkan dengan peningkatan keinginan bunuh diri di kalangan remaja. Paparan informasi di media sosial memang sebaiknya ditanggapi dengan bijaksana. Hal ini menjadi salah satu cara untuk memastikan kesehatan mental selalu terjaga. Bagi orang dewasa yang berada di sekitar remaja sebaiknya waspada, terutama jika muncul tanda-tanda remaja merasa tidak puas dengan diri sendiri dan selalu membandingkan dirinya dengan orang atau postingan yang ada di Instagram. Risiko gangguan makan alias eating disorder disebut meningkat pada remaja yang aktif menggunakan media sosial. Sekali lagi, hal ini ternyata berkaitan dengan penggambaran citra tubuh ideal yang ada di internet. Hal itu membuat remaja merasa harus mengikuti standar tersebut dan berujung pada kebiasaan makan yang buruk untuk menghindari risiko kegemukan atau obesitas. Gangguan kesehatan mental lain yang bisa muncul adalah depresi, rasa percaya diri yang rendah, hingga gangguan kecemasan. Hal ini disebut berkaitan dengan penggunaan media sosial Instagram. Sebagian besar pengguna media sosial Instagram gemar mengunggah foto diri alias selfie. Nah, kebiasaan ini ternyata juga bisa menjadi sumber masalah. Remaja yang mengunggah foto di Instagram disebut sering merasa dirinya tidak menarik, dan hal ini berhubungan dengan perubahan suasana hati. Remaja cenderung memiliki keinginan untuk terus mengulang pengambilan gambar serta melakukan proses editing, dan tetap saja merasa tidak puas. Secara tidak langsung, hal ini juga berkontribusi dengan fenomena body image yang ada di dunia maya. Ada temuan yang menyebut bahwa keinginan untuk melukai diri sendiri bahkan bunuh diri meningkat pada remaja yang banyak menghabiskan waktu di media sosial. Hal ini berkaitan dengan paparan informasi, pengalaman, hingga komentar yang didapat atau dibaca di media sosial. "
9 Cara Sederhana Menjaga Kesehatan Mental,,,https://www.halodoc.com/artikel/9-cara-sederhana-menjaga-kesehatan-mental,,,,,,"Untuk meningkatkan kesejahteraan secara keseluruhan, kamu tidak bisa hanya berfokus pada kesehatan fisik. Kesehatan mental juga memainkan peran yang besar dalam kehidupan. Kesehatan mental sebagai kemampuan diri sendiri untuk mengelola perasaan dan menghadapi kesulitan sehari-hari. Beberapa langkah sederhana bisa diterapkan untuk meningkatkan kualitas kesehatan mental. Dengan melakukan perubahan ini, maka dapat dipastikan hal ini memengaruhi semua aspek kehidupan. Dengan menjaga kesehatan mental, maka kamu merasakan beberapa efeknya seperti suasana hati yang membaik, membangun ketahanan, dan membantu menikmati hidup secara keseluruhan. Nah, untuk kamu yang merasa mudah mengalami stres atau gangguan kecemasan, berikut ini beberapa hal sederhana yang dapat meningkatkan kesehatan mental Penelitian menunjukkan bahwa cara kamu berpikir tentang diri sendiri dapat memiliki efek yang kuat pada kejiwaan kamu. Ketika kita memandang diri kita dan hidup kita secara negatif, maka kita juga merasakan efek negatifnya. Sebaliknya, jika membiasakan diri menggunakan kata-kata yang membuat lebih positif, maka hal ini membuat kamu lebih optimis. Rasa bersyukur dikaitkan dengan peningkatan kesejahteraan, kualitas kesehatan mental, serta kebahagiaan. Cara sederhana untuk meningkatkan rasa bersyukur adalah membuat jurnal dan menuliskan berbagai hal yang patut disyukuri setiap harinya. Secara umum merenungkan rasa terima kasih juga efektif, tetapi kamu perlu berlatih secara teratur untuk mendapatkan manfaat jangka panjang. Temukan sesuatu untuk disyukuri dan nikmati perasaan tersebut dalam hatimu. Fokus kepada tujuan mampu melepaskan emosi negatif atau sulit dari pengalaman masa lalu yang membebani. Mulailah dengan membawa kesadaran bahkan untuk hal-hal sederhana seperti mandi, makan siang, atau berjalan pulang. Memberi perhatian pada sensasi fisik, suara, bau, atau rasa dari pengalaman ini membantu kamu untuk fokus. Ketika pikiran kamu terbang melayang hingga menyebabkan kamu overthinking, maka bawa saja kembali ke apa yang kini kamu tengah lakukan. Tubuh akan melepaskan endorfin yang membantu menyingkirkan stres dan meningkatkan suasana hati kamu sebelum dan sesudah berolahraga. Itulah sebabnya olahraga adalah cara penangkal stres, kecemasan, dan depresi yang ampuh. Carilah cara-cara kecil untuk menambah aktivitas olahraga, seperti naik tangga, atau jalan kaki ke tempat yang dekat. Untuk mendapatkan manfaat maksimal, lakukan olahraga setidaknya 30 menit setiap hari, dan coba melakukannya di luar ruangan. Paparan sinar matahari juga membantu tubuh menghasilkan vitamin D, yang meningkatkan tingkat serotonin di otak. Selain memberikan nutrisi yang dibutuhkan, makan lezat dan sehat juga menyehatkan otak. Karbohidrat (dalam jumlah sedang) meningkatkan serotonin, bahan kimia yang terbukti memiliki efek menenangkan pada suasana hati. Sementara itu makanan kaya protein membantu kamu tetap waspada. Sayuran dan buah-buahan dipenuhi dengan nutrisi yang memberi makan setiap sel tubuh, termasuk yang mempengaruhi bahan kimia otak yang mengatur suasana hati. Sertakan makanan dengan asam lemak tak jenuh ganda Omega-3 (ditemukan dalam ikan, kacang-kacangan, dan biji rami). Nutrisi ini dapat meningkatkan suasana hati dan mengembalikan integritas struktural pada sel-sel otak yang diperlukan untuk fungsi kognitif. Mengetahui bahwa kamu dihargai oleh orang lain adalah penting untuk membantu kamu berpikir lebih positif. Belajar terbuka kepada orang lain, yang membuat kamu lebih mampu berpikir positif dan semakin mengenal diri sendiri. Penelitian menunjukkan bahwa membantu orang lain memiliki efek menguntungkan pada perasaan kamu tentang diri sendiri. Bersikap membantu dan ramah adalah cara yang baik untuk membangun harga diri. Makna yang ditemukan dalam membantu orang lain memperkaya dan memperluas hidupmu. Pada saat-saat semua pekerjaan terasa seperti terlalu banyak, menjauhlah, dan lakukan apa pun kecuali hal yang membuat kamu semakin stres, setidaknya sampai kamu merasa sedikit lebih baik. Terkadang hal terbaik untuk dilakukan adalah latihan pernapasan sederhana: Tutup mata dan ambil 10 tarikan napas dalam-dalam. Untuk masing-masing tarikan napas, hitung sampai empat saat menarik napas, tahan selama empat hitungan, dan buang napas untuk empat hitungan. Hal ini bekerja baik untuk membantu kamu melawan stres. Sejumlah besar penelitian menunjukkan bahwa kurang tidur memiliki efek negatif yang signifikan pada suasana hati. Coba tidur pada waktu yang teratur setiap hari. Hindari bermain gadget sebelum waktu tidur dan membatasi minuman berkafein untuk pagi hari. Jadi mulai sekarang, kamu memiliki berbagai cara langkah-langkah positif sederhana untuk menjaga kesehatan mental kamu. Cara menjaga kesehatan mental seperti yang disebutkan diatas tidaklah sulit dilakukan, kamu hanya memerlukan menerapkannya secara bertahap dan penuh ketelatenan dalam menerapkannya supaya mendapatkan manfaat jangka panjang. "
Kesehatan Mental Bisa Memengaruhi Kesehatan Fisik,,,https://www.halodoc.com/artikel/kesehatan-mental-bisa-memengaruhi-kesehatan-fisik,,,,,,"Kesehatan fisik yang buruk dapat meningkatkan risiko timbulnya masalah kesehatan mental. Demikian pula, kesehatan mental yang buruk dapat berdampak negatif pada kesehatan fisik. Walaupun kelihatannya pikiran hanya ada dalam benak saja, nyatanya pikiran yang mengganggu bisa memengaruhi fungsi-fungsi tubuh yang lainnya. Akibatnya, kamu pun rentan mengalami berbagai kondisi medis tertentu. Emosi positif ternyata berkorelasi dengan keadaan mental seseorang, begitu pula sebaliknya. Stres adalah contoh yang paling umum. Menurut American Psychological Association (APA), seseorang yang mengalami stres seringkali mengalami sakit perut. Lantas, bagaimana jadinya kalau seseorang mengalami stres kronis? Stres kronis yang tidak kunjung diobati mampu melemahkan tubuh dari waktu ke waktu. Emosi negatif seperti kemarahan ternyata juga bisa memicu serangan jantung dan masalah fisik lainnya. Melansir dari Mental Health Foundation, orang dengan tingkat kesusahan tertinggi punya peluang 32 persen meninggal karena kanker. Sedangkan seseorang yang mengalami depresi, diketahui mengalami peningkatan risiko penyakit jantung koroner. Sedangkan seseorang yang mengidap skizofrenia sering dikaitkan dengan risiko kematian akibat penyakit jantung dan risiko kematian akibat penyakit pernapasan sebanyak tiga kali lipat. Mengapa ini bisa terjadi? Ternyata, orang dengan kondisi kesehatan mental cenderung tidak menerima perawatan kesehatan fisik yang berhak mereka terima. Mereka juga cenderung tidak ditawari bantuan untuk berhenti merokok, mengurangi konsumsi alkohol dan mengubah pola makan menjadi lebih sehat . Menurut meta analisis Universitas Harvard pada 2012, orang yang punya optimisme memiliki jantung yang lebih sehat dan bahkan dapat menurunkan laju perkembangan penyakit. Faktor-faktor lain, seperti kepuasan hidup dan kebahagiaan, dikaitkan dengan penurunan risiko penyakit kardiovaskular terlepas dari faktor-faktor seperti usia seseorang, status sosial ekonomi, status merokok, atau berat badan. Boehm, seorang peneliti di Harvard School of Public Health's Department of Society, menyatakan bahwa individu yang paling optimis memiliki risiko sekitar 50 persen lebih rendah mengidap penyakit kardiovaskular, jika dibandingkan dengan rekan-rekan mereka yang kurang optimis. Gaya hidup ternyata menjadi faktor utama yang memengaruhi kesehatan mental dan fisik seseorang. Berikut gaya hidup yang mampu meningkatkan kesehatan mental dan fisik seseorang: Sudah bukan rahasia lagi kalau aktivitas fisik dalam bentuk apapun adalah cara yang paling tepat untuk menjaga kesehatan fisik serta meningkatkan kesejahteraan mental. Penelitian menunjukkan bahwa melakukan olahraga memengaruhi pelepasan dan penyerapan bahan kimia yang disebut endorfin di otak. Nutrisi yang baik termasuk faktor yang mampu mempengaruhi perasaan seseorang. Pola makan yang sehat dan seimbang mencakup protein dalam jumlah yang sehat, lemak esensial, karbohidrat kompleks, vitamin, mineral, dan air. Setiap makanan yang kamu konsumsi dapat memengaruhi perkembangan, pengelolaan, dan pencegahan berbagai kondisi kesehatan mental, termasuk depresi dan Alzheimer. Merokok berdampak negatif pada kesehatan mental dan fisik. Banyak orang dengan masalah kesehatan mental percaya bahwa merokok dapat meredakan gejalanya, tetapi efek ini hanya bersifat jangka pendek. Nikotin dalam rokok mengganggu bahan kimia di otak. Dopamin adalah bahan kimia yang memengaruhi perasaan positif dan faktanya bahan kimia ini jumlahnya lebih rendah pada orang yang mengalami depresi. Nikotin memang mampu meningkatkan kadar dopamin sementara, tetapi bahan ini juga mematikan mekanisme alami otak untuk membuat zat kimia tersebut. Dalam jangka panjang, ini bisa membuat seseorang merasa seolah-olah membutuhkan lebih banyak nikotin untuk mengulangi sensasi positif ini."
Mengakui Tidak Baik-Baik Boleh Dilakukan Agar Mental Sehat,,,https://www.halodoc.com/artikel/mengakui-tidak-baik-baik-boleh-dilakukan-agar-mental-sehat,,,,,,"Ada berbagai macam cara yang bisa dilakukan untuk menjaga mental tetap sehat. Banyak ahli yang mengatakan perlu melakukan olahraga rutin, mengonsumsi makanan sehat, dan menurunkan tingkat stres. Namun, banyak orang yang lupa jika perlu juga untuk mengaku jika kamu sedang tidak baik-baik saja. Untuk pembahasan lebih lengkap, baca ulasan berikut ini! Sebuah penelitian yang dilakukan oleh Mental Health Foundation, disebutkan dari 2.000 orang dewasa mengatakan “Saya baik-baik saja” sebanyak 14 kali dalam seminggu. Pada faktanya, hanya sekitar 19% dari total angka yang ada jika mereka benar-benar sungguh sehat secara mental. Dikatakan jika hampir sepertiga dari total orang yang disurvei berkata jika mereka sering berbohong tentang perasaannya pada orang lain. Sementara itu, 1 dari 100 orang mengungkapkan jika dirinya selalu berbohong tentang keadaan emosinya. Dapat disimpulkan jika lebih dari 50% telah memperkirakan jawabannya bohong saat bertanya tentang perasaan. Apakah dengan mengatakan yang bukan sebenarnya dapat membuat orang di sekitar tahu tentang keadaan yang dirasakan? Tentu jawabannya tidak. Faktanya, dengan bersikap terbuka tentang kesehatan mental dapat membantu untuk menciptakan lingkungan yang jujur dan terbuka di sekitar kamu. Dengan mengungkapkan usaha keras kamu selama ini bisa menjadi bentuk kelegaan yang sangat besar. Pada beberapa kasus, setelah mengatakan jika “tidak baik-baik saja”, kamu merasa tidak menghadapinya sendirian dan membuat pikiran lebih baik. Memang terasa canggung di awal untuk memulai percakapan, tetapi akan jauh membaik setelahnya. Tentu sulit untuk mengungkapkan sesuatu yang dirasakan, terutama pada atasan di kantor. Namun, semakin berkembangnya pengetahuan tentang kesehatan mental, diharapkan semua orang di sekitar kamu, baik dari lingkungan keluarga, pertemanan, hingga kantor dapat membantu untuk kesembuhan. Selain hal di atas, ada beberapa cara yang dapat dilakukan untuk mendapatkan mental sehat selain mengungkapkan jika kamu tidak baik-baik saja. Berikut langkah-langkah yang perlu diperhatikan: Cara pertama yang perlu dilakukan untuk menjaga mental tetap sehat adalah menemukan yang bisa kamu percaya saat bercerita. Pastikan juga untuk menceritakan hal-hal yang kecil terlebih dahulu. Mungkin bisa diawali dengan memulai menceritakan perasaan stres setelah seharian bekerja. Jangan sekaligus menceritakan semuanya karena mungkin saja orang tersebut merasa terbebani. Kamu juga perlu melakukan pertemuan rutin dengan terapis dan menganggapnya sebagai pelatih pribadi. Ahli medis ini dapat membantu untuk memahami perasaan saat kamu membicarakan emosi yang ada. Seiring waktu, kamu membangun ketahanan dan kekuatan batin yang lebih baik. Sama seperti tubuh, mental juga perlu dilatih agar menjadi lebih baik. Salah satu cara untuk memproses emosi yang rumit diungkapkan adalah dengan menuliskannya. Para psikolog menyebutnya sebagai jurnal terapeutik. Penempatan sesuatu yang dituliskan dapat membantu orang lain lebih memahaminya. Tentu hal ini dapat menjadi langkah besar untuk berbagi pengalaman dan mengurangi stres yang tertahan."
Ketahui Dampak Negatif Sosial Media bagi Kesehatan Mental,,,https://www.halodoc.com/artikel/ketahui-dampak-negatif-sosial-media-bagi-kesehatan-mental,,,,,,"Dewasa ini, penggunaan sosial media di masyarakat tentu sudah menjadi salah satu kebutuhan sehari-hari. Terutama bagi orang dewasa, remaja, hingga anak-anak. Tak dapat dipungkiri bahwa sosial media telah terintegrasi dengan kuat ke dalam kehidupan, tanpa terkecuali bagi masyarakat Indonesia. Sebab, sosial media membuat setiap orang dapat menggunakan ponsel mereka untuk mencari informasi sekaligus tetap terhubung dengan orang lain secara mudah. Meski begitu, sosial media tetaplah memiliki kelemahan dan sisi gelap bagi kehidupan manusia. Pasalnya, beberapa bukti menunjukkan bahwa sosial media dapat memberikan dampak negatif pada kesehatan mental, bila digunakan secara berlebihan. Kira-kira apa saja dampak negatifnya ya? Yuk simak penjelasannya di sini! Beberapa penelitian menunjukkan bahwa penggunaan sosial media secara berlebihan dapat memberikan berbagai dampak negatif, antara lain: Berdasarkan studi yang diterbitkan dalam jurnal Computers and Human Behaviour, orang yang dilaporkan menggunakan tujuh atau lebih platform sosial media, tiga kali lebih mungkin mengalami gejala kecemasan umum tingkat tinggi, dibanding mereka yang hanya menggunakan sekitar dua platform sosial media saja. Meski begitu, belum dapat dipastikan secara jelas apakah dan bagaimana sosial media dapat menyebabkan kecemasan. Beberapa penelitian telah menemukan adanya keterkaitan antara depresi dan penggunaan sosial media. Salah satunya adalah penelitian yang melibatkan lebih dari 700 siswa menemukan bahwa gejala depresi. Misalnya seperti suasana hati yang rendah, perasaan tidak berharga, dan putus asa, berkaitan dengan kualitas interaksi secara daring. Hasil penelitian juga menunjukkan adanya lebih banyak interaksi negatif pada mereka yang memiliki tingkat gejala depresi lebih tinggi. Bila dibandingkan dengan mereka yang tingkat gejala depresinya lebih rendah. Tidur yang cukup dan berkualitas tentu berkaitan dengan kesehatan tubuh dan mental secara keseluruhan. Namun, pencahayaan buatan yang berasal dari layar smartphone dipercaya dapat mengganggu kualitas tidur. Penelitian telah menemukan bahwa hal tersebut dapat menghambat produksi hormon melatonin tubuh. Perlu diketahui bahwa hormon melatonin adalah hormon yang membantu seseorang tertidur dan mengatur pola tidur. Selain itu, penelitian yang dilakukan oleh University of Pittsburgh melakukan survey terhadap 1.700 anak berusia 18 hingga 30 tahun, tentang sosial media dan pola tidur mereka. Hasilnya, ditemukan adanya keterkaitan antara menggunakan sosial media dengan gangguan tidur. Disimpulkan bahwa blue light atau cahaya biru dari layar smartphone berperan dalam hal tersebut. Para peneliti mengatakan bahwa hal ini dapat disebabkan oleh gairah fisiologis sebelum tidur. Selain itu, cahaya terang dari layar perangkat elektronik juga dapat menunda ritme sirkadian. Namun, penelitian lebih mendalam tentu masih dibutuhkan untuk benar-benar memastikannya. Dilansir dari Medical News Today, Dr. Shannon M. Rauch dari Universitas Benediktin di Arizona, Amerika Serikat, mengatakan bahwa salah satu alasan utama kita menggunakan sosial media adalah mengalihkan perhatian dan menghilangkan kebosanan. “Oleh karena itu, sosial media memberikan penguatan setiap kali seseorang masuk,” katanya. Perilaku tersebut dapat menyebabkan kecanduan sosial media. Faktanya, perilaku seperti itu sangatlah umum, sehingga para peneliti telah menciptakan skala psikologis untuk mengukur kecanduan, yaitu Skala Kecanduan Facebook Berge (BFAS). Penelitian pun dilakukan dengan menggunakan skala tersebut berdasarkan enam kriteria untuk mengukur kecanduan Facebook. Menariknya, para peneliti menemukan bahwa orang yang lebih cemas dan tidak aman secara sosial, lebih cenderung menggunakan situs jejaring sosial. Dari studi tersebut, tampaknya pengguna yang kecanduan Facebook menggunakan sosial media sebagai cara untuk mendapatkan perhatian dan meningkatkan harga diri mereka. Nah, itulah beberapa dampak negatif penggunaan sosial media bagi kesehatan mental yang dapat timbul. Menggunakan sosial media untuk terhubung dengan orang lain sebenarnya sangatlah wajar. Namun, jangan sampai menggunakannya secara berlebihan, karena dapat memicu rasa ketagihan, hingga depresi. Selain itu, pastikanlah untuk berhenti menatap layar ponsel sebelum tidur, agar kualitas tidur tidak terganggu akibat cahayanya. Bila kamu merasakan keinginan untuk terus-menerus memainkan sosial media, segeralah periksakan diri ke psikolog. Sebab, hal tersebut bisa jadi merupakan gejala bahwa kamu mengalami kecanduan sosial media. Kondisi ini tentu jangan sampai dibiarkan, karena dapat menghambat aktivitas dan produktivitas."
Ini Cara untuk Mengatasi Mental Burnout Saat Pandemi,,,https://www.halodoc.com/artikel/ini-cara-untuk-mengatasi-mental-burnout-saat-pandemi,,,,,,"Selama masa pandemi, tidak sedikit orang yang mengalami burnout. Kondisi tersebut bisa terjadi bila kamu memiliki beban kerja atau tanggung jawab yang terlalu banyak yang melebihi kapasitas kamu, tanpa adanya bantuan yang cukup. Burnout bisa terjadi, baik secara fisik maupun mental. Untuk burnout secara fisik, tidak ada cara lain yang lebih efektif selain mengambil waktu yang cukup untuk beristirahat. Namun, mengatasi mental burnout mungkin tidak semudah melakukan relaksasi. Meski begitu, kamu tidak boleh membiarkan kondisi tersebut berlarut-larut. Ketahui beberapa cara yang bisa kamu lakukan untuk mengatasi mental burnout di sini, agar kamu bisa kembali memiliki pikiran yang sehat dan segar untuk menjalani hari dengan maksimal. Mental burnout seringkali terjadi secara bertahap, sehingga kamu mungkin tidak segera menyadari gejalanya. Namun, ketika kondisi tersebut terjadi, hal itu bisa memengaruhi kemampuan kamu berfungsi di semua aspek kehidupan. Sulit untuk mengatasi sesuatu tanpa mengetahui apa penyebabnya. Karena itu, penting untuk mencari tahu faktor atau sumber stres yang menyebabkan kamu mengalami mental burnout agar kamu bisa mengatasinya. Mencoba melakukan terlalu banyak tanggung jawab juga bisa menciptakan lingkungan yang ideal untuk kejenuhan. Misalnya, kamu adalah orangtua yang bekerja dari rumah. Selain harus memenuhi tuntutan pekerjaan, kamu juga harus mengurus dan menemani anak-anak yang sekolah di rumah, serta mengerjakan pekerjaan rumah tangga. Tanpa adanya bantuan yang cukup dari orang lain dan kurangnya waktu istirahat, lama-kelamaan kamu bisa mengalami stres yang berujung pada burnout. Bila stres hanya disebabkan oleh satu faktor, hal itu mungkin bisa dengan mudah diatasi sendiri. Namun, bila ada beberapa faktor penyebab stres, kamu mungkin akan kewalahan bila tidak mendapatkan bantuan atau dukungan. Setelah mengetahui sumber mental burnout kamu, kamu mungkin sudah mengetahui beberapa cara untuk mengatasinya segera. Lakukanlah segera! Misalnya, bila menerima tiga proyek sekaligus menyebabkan kamu bekerja selama berminggu-minggu tanpa bisa memiliki waktu istirahat yang cukup, mintalah supervisor kamu untuk mengurangi jumlah pekerjaan atau meminta tambahan orang ke dalam tim kamu. Sudah kewalahan dengan pekerjaan tapi tidak enak menolak ajakan teman-teman untuk hangout? Bila waktu kamu sudah habis untuk mengerjakan semua tugas penting yang perlu kamu lakukan, menambah aktivitas mungkin bisa membuat kamu lebih stres dan frustasi. Jadi, pertimbangkanlah untuk membatalkan atau menjadwal ulang beberapa janji temu dengan orang lain. Melibatkan orang terkasih yang terpercaya bisa membantu kamu mendapatkan dukungan yang diperlukan untuk mengatasi mental burnout dan agar tidak merasa sendirian. Berbicara dengan sahabat, anggota keluarga, dan rekan kerja memungkinkan kamu untuk bisa bertukar pikiran dengan mereka mengenai solusi yang bisa dilakukan untuk mengatasi burnout. Saat mengalami mental burnout, kamu mungkin akan merasa gagal dan seperti kehilangan tujuan atau arah hidup. Kamu mungkin juga merasa seolah-olah kamu tidak bisa melakukan apa pun dengan benar atau kamu tidak akan pernah mencapai tujuan kamu. Namun, cobalah untuk memberikan diri sendiri cinta dan dukungan. Ingatkan diri sendiri bahwa kamu tidak harus sempurna dan tidak apa-apa untuk beristirahat. Untuk mengatasi burnout, baik fisik maupun mental, kamu perlu mengisi kembali kebutuhan tubuh kamu secara keseluruhan. Idealnya, untuk mengatasi kelelahan, kamu perlu mengambil cuti, mengosongkan jadwal, dan mengkhususkan hari itu untuk beristirahat dan relaksasi. Namun, tidak semua orang bisa melakukan hal itu. Burnout yang parah bisa menguras kamu hingga kamu sulit mengingat apa yang dulu kamu nikmati. Kamu mungkin kehilangan gairah untuk kareir yang pernah kamu cintai, tidak lagi peduli dengan hobi favorit kamu, atau merasa kesal terus-menerus dengan pasangan atau anak."
