Judul_Artikel,,,Link_Artikel,,,,,,Isi_Artikel
Mental Sehat di Hari Senin Ini 5 Triknya,,,https://www.halodoc.com/artikel/mental-sehat-di-hari-senin-ini-5-triknya,,,,,,"Bagi sebagian besar orang, memulai kembali hari senin mungkin menjadi rutinitas yang “menyeramkan”. Enggak heran, karena biasanya awal minggu akan ada banyak pekerjaan yang harus dilakukan. Apalagi buat kamu yang menghabiskan akhir pekan dengan liburan, kembali ke rutinitas seringkali terasa berat untuk dilakukan. Nah, agar kamu enggak terjebak di sindrom I Hate Monday, alangkah baiknya jika kamu melakukan trik khusus untuk mengatasinya. Yuk, cari tahu berikut ini: Melakukan “me time” dapat kamu lakukan pada akhir pekan untuk memanjakan diri sendiri. Memanjakan diri kamu dapat diartikan sebagai apresiasi atau memberikan penghargaan terhadap kerja keras dan rutinitas yang membosankan selama seminggu. Kamu dapat melakukannya dengan tidur siang, menghabiskan waktu untuk membaca buku, atau melakukan hal-hal yang kamu tidak dapat lakukan ketika bekerja, seperti perawatan di salon. Dengan menghabiskan waktu melalui kegiatan yang kamu suka, tentunya kamu dapat mengurangi stres akibat pekerjaan. Hal ini bertujuan agar ketika hari senin sudah datang kembali, mood dan semangat kamu sudah siap untuk menyambut awal minggu tersebut. Tentunya kamu juga dapat menghabiskan waktu bersama-sama dengan teman atau keluarga. Banyak kegiatan yang dapat dilakukan bersama orang-orang terdekat, seperti mencicipi menu di restoran baru, melakukan wisata kuliner, menonton film bersama, atau bahkan memasak bersama. Me time juga dapat menjaga kesehatan mental dan mencegah depresi akibat stres yang berlebihan, lho. Akhir pekan yang singkat jika tidak digunakan secara maksimal akan membuatmu menyesal. Untuk itu, waktu kosong antara hari sabtu dan minggu dapat kamu gunakan untuk membersihkan kamar tidur atau bahkan rumah. Kamar tidur bersih dan rapi tentunya memberikan perasaan nyaman yang dapat meningkatkan produktivitas. Selain itu, kamar yang nyaman akan membuat tidur lebih berkualitas. Hal ini bertujuan agar kamu tidur dengan nyenyak saat pergantian hari ke senin. Tidur yang nyenyak dan cukup, tentu akan membuat kamu bangun dengan segar dan meningkatkan semangat untuk menjalani aktivitas. Menjalani rutinitas mungkin membuatmu melakukan banyak kegiatan buruk. Nah, libur akhir pekan dapat kamu gunakan untuk mengonsumsi makanan sehat, dan olahraga. Kamu juga harus menjaga kesehatan untuk kembali memulai rutinitas ketika ketika senin datang. Selain itu, kamu juga dapat menyusun jadwal untuk melakukan berbagai kegiatan. Jadwal ini dapat kamu buat berdasarkan janji dan rencana kedepannya. Selain membuat pengelolaan waktu lebih baik, menyusun jadwal dapat membuat kamu lebih semangat ketika hari senin, karena membuatmu lebih terpacu untuk cepat melewati hari. Ketika hari senin tiba, kamu juga harus menyiapkan sarapan yang sehat dan lezat. Konsumsi makanan lezat seharusnya dapat meningkatkan suasana hatimu. Jangan melewatkan sarapan karena dapat menyebabkan makan siangmu menjadi lebih banyak. Makan terlalu banyak dapat menyebabkan rasa kantuk berlebihan yang dapat mengganggu semangatmu. Selain itu, makan terlalu banyak juga meningkatkan risiko untuk terserang diabetes dan juga obesitas. Terjebak macet dapat membuat suasana hati jadi berantakan. Untuk itu, kamu harus menghindari kemacetan dengan berangkat lebih awal. Memulai hari senin dengan berangkat lebih awal juga dinilai lebih sehat, karena kamu juga terhindar dari paparan polusi yang berlebihan karena suasana jalan masih sepi. Paparan polusi yang berlebihan dapat meningkatkan risiko kamu terserang berbagai penyakit pernapasan seperti ISPA atau gangguan pada kulit. Berangkat lebih awal juga sebaiknya dilakukan setiap hari, agar suasana hati tetap baik ketika sampai di tempat bekerja. Memulai hari senin juga dapat dilakukan dengan mendengarkan musik favorit. Kamu dapat mendengarkan musik yang kamu suka ketika sedang berangkat, maupun saat sudah berada di kantor. Musik dapat memberikan ketenangan pada pikiran, serta menjaga mood tetap baik. Jika kamu merasa pekerjaan atau lingkungan kerja semakin membuat stres, kamu dapat hubungi psikolog di Halodoc. Tidak sulit kok membuat hari senin terasa menyenangkan dan lebih baik untuk memulai hari kalau kamu tahu cara mengatasinya. "
Ketahui 6 Cara Mendukung Kesehatan Mental Anak,,,https://www.halodoc.com/artikel/ketahui-6-cara-mendukung-kesehatan-mental-anak,,,,,,"Setiap orang tua pasti ingin yang terbaik untuk kesehatan anaknya, baik dari segi fisik maupun mental. Namun, tidak semua ayah dan ibu benar-benar paham tentang kesehatan mental dan hal yang perlu dilakukan untuk mendukungnya. Untuk mengetahui cara mendukung kesehatan mental anak, baca ulasan berikut ini ya! Mendukung kesehatan mental anak sama pentingnya saat menjaga kesehatan fisik. Keduanya harus saling beriringan tanpa perlu fokus di satu titik. Dengan begitu, anak bisa tumbuh menjadi pribadi yang tidak mudah sakit dan juga kuat secara mental. Namun, cara apa saja yang bisa dilakukan untuk menjaga kesehatan mental anak? Berikut caranya: Salah satu cara untuk menjaga kesehatan mental anak adalah dengan rutin mendengarkan keluhannya. Cobalah untuk tanyakan kabarnya secara teratur tiap pulang sekolah atau menjelang tidur. Dengan terbiasa membicarakan perasaannya, ia jadi paham jika orang tuanya selalu ada saat ia butuh teman bicara. Cari waktu yang tepat jika melihat ia benar-benar sedih atau tertekan. Ibu dan ayah perlu rutin memperhatikan emosi dan perilakunya. Jika ada sesuatu yang berbeda, cobalah bertanya dan bantu anak untuk melewati kesulitan tersebut. Memang tidak mudah melewati perilaku tersebut, terlebih jika ia menjadi lebih sering menantang. Alangkah lebih baiknya jika coba untuk memahami apa yang dirasakannya dan alasan hal tersebut bisa terjadi Cara lainnya untuk menjaga kesehatan mental anak adalah mengajarkannya cara yang tepat untuk mengendalikan emosi negatif. Orang tua bisa mengajarkan keterampilan koping di rumah, seperti bernapas dalam-dalam, menggunakan bola stres, membuat sebuah karya seni, berjalan-jalan, hingga berolahraga. Pilih cara terbaik untuk melakukannya agar anak tetap sehat secara mental. Perlu membuat rutinitas di rumah untuk anak. Sebab, ketidakpastian dalam jadwal harian dapat menyebabkan stres dan kecemasan pada kehidupan anak. Cobalah untuk membuatkannya jadwal makan, tidur, hingga menonton film secara mingguan. Selain itu, buat juga batasan di rumah, seperti batas jam tidur, misalnya. Cara paling penting untuk menjaga kesehatan mental anak adalah memperlihatkan jika dirinya dicintai dan selalu mendapat dukungan dari orang tuanya. Pastikan ia tahu jika ayah dan ibunya selalu mencintainya dan memberi dukungan terkait segala hal yang dilakukannya selama itu positif. Ini tentu dapat menimbulkan perasaan dirinya aman berada di rumah. Dengan membuatnya terus aktif dan kreatif, serta terus mempelajari hal-hal yang baru dapat meningkatkan hubungan anak dengan orang tuanya. Tentu hal ini adalah cara penting untuk membantu anak untuk menjaga kesehatan mentalnya. Terus dukung dan dorong dirinya untuk terus meningkatkan bakat serta mengeksplorasi minatnya. Itulah beberapa cara yang bisa ibu lakukan untuk mendukung kesehatan mental anak. Peran orang tua sangat penting dalam hal ini yang tentu saja dapat memengaruhi masa depannya saat beranjak dewasa. Dengan memiliki mental yang sehat dan kuat, anak tidak mudah menyerah untuk menghadapi kesulitan apa pun."
Manfaat Membaca Buku bagi Kesehatan Mental,,,https://www.halodoc.com/artikel/manfaat-membaca-buku-bagi-kesehatan-mental,,,,,,"Membaca buku menjadi salah satu kegiatan yang bisa dilakukan siapa saja, mulai dari anak-anak hingga orang dewasa. Bukan hanya menambah kosakata pembacanya, kegiatan ini dinilai menjadi salah satu cara yang bisa dilakukan agar kesehatan mental tetap terjaga dengan baik. Terjaganya kesehatan mental membuat kamu bisa mendapatkan kualitas hidup yang lebih baik. Nah, tidak ada salahnya simak berbagai ulasan mengenai manfaat membaca buku bagi kesehatan mental, di sini! Ada banyak jenis buku yang bisa menjadi buku kegemaran, seperti misalnya buku cerita fiksi, dongeng, biografi, hingga berbagai buku lainnya yang dapat menambah ilmu dan kosakata pembacanya. Selain itu, banyak manfaat membaca buku yang bisa kamu rasakan, khususnya bagi kesehatan mental. Membaca menjadi salah satu kegiatan yang dilakukan saat kamu mengalami rasa penat atau bosan. Bahkan, membaca buku dinilai sangat efektif dalam menurunkan tingkat stres. Bahkan, saat kamu membaca buku kegemaranmu, kebiasaan ini bisa membantu kamu menjadi lebih rileks dan menurunkan perasaan sedih atau cemas yang sedang kamu rasakan. Dengan membaca buku, kamu bisa melepaskan penat akibat pikiran yang sejenak menikmati bacaan yang kamu baca. Pelarian imajinasi yang dialami membuat kamu teralihkan dari stres yang kamu alami secara sementara. Dengan membaca, fokus dan perhatian kamu akan menjadi lebih baik. Dengan fokus pada salah satu kegiatan, kamu bisa membuat tubuh dan pikiran menjadi lebih rileks. Hal ini juga berkaitan dengan kemampuan melepaskan rasa khawatir terhadap kondisi yang sedang kamu alami. Manfaat membaca buku dalam menurunkan tingkat stres seseorang juga berkaitan dengan pencegahan depresi yang mungkin terjadi. Depresi bisa terjadi akibat tingkat stres yang tidak diatasi dengan baik. Dengan mengatasi stres yang kamu rasakan, tentunya kamu menurunkan risiko mengalami depresi atau stres yang lebih buruk. Carilah berbagai jenis buku kesukaan kamu agar kamu bisa merasakan manfaat membaca buku untuk kesehatan mental. Daripada bermain gadget sebelum tidur, lebih baik lakukan kebiasaan membaca buku. Membaca buku sebelum tidur dikaitkan dengan peningkatan kualitas tidur. Pastikan kamu membaca buku dalam bentuk cetak, bukan dari gadget. Hindari juga membaca buku diatas tempat tidur, agar manfaatnya bisa kamu rasakan dengan baik. Penelitian yang dipublikasikan oleh Oxford University Press dalam jurnal berjudul “The Survival Advantage of Reading Books”, kelompok orang yang gemar membaca buku ternyata memiliki usia lebih panjang dua tahun dibandingkan mereka yang tidak membaca buku. Selain itu, kelompok yang membaca buku selama 3,5 jam setiap harinya memiliki hidup lebih panjang dan sehat dibandingkan mereka yang tidak suka membaca buku. Meskipun begitu, kamu juga harus melakukan gaya hidup sehat dan mengonsumsi berbagai makanan sehat untuk menjaga kesehatan lebih baik."
Kesehatan Mental Orang Tua Berpengaruh pada Anak,,,https://www.halodoc.com/artikel/kesehatan-mental-orang-tua-berpengaruh-pada-anak,,,,,,"Kesehatan mental orang tua berhubungan dengan kondisi kesehatan mental anak, bahkan tidak jarang juga bisa memengaruhi keharmonisan keluarga. Meskipun banyak orang tua dengan masalah kesehatan mental dapat merawat anak-anaknya dengan baik, mereka tetap memerlukan dukungan ekstra dari keluarga, teman atau profesional. Ingat, hampir semua orang tua akan menghadapi tantangan dalam merawat anak. Namun, jika itu termasuk masalah kesehatan mental, maka orang tua mungkin menghadapi tantangan tambahan. Masalah kesehatan mental dapat bervariasi, mulai dari seberapa parah kondisi tersebut, hingga bagaimana pengaruhnya terhadap anak dan keluarga. Pengalaman hidup yang penuh tekanan pastinya dapat membuat segalanya lebih menantang. Misalnya masalah finansial maupun masalah pekerjaan, keduanya bisa berdampak negatif pada kesehatan mental. Namun tahukah kamu, masalah kesehatan yang tidak dikelola dengan baik dapat berpengaruh pada anak bahkan keharmonisan keluarga. Tumbuh kembang seorang anak bergantung pada orang tua mereka. Orang tua menjadi sumber dukungan pertama untuk anak menjadi mandiri dan menjalani kehidupan yang sehat dan sukses. Kesehatan mental orang tua dan anak juga terhubung dalam berbagai cara. Orang tua yang memiliki masalah kesehatan mental, misalnya depresi atau kecemasan, mungkin lebih sulit memberikan perawatan untuk anak dibandingkan dengan orang tua dengan kesehatan mental yang baik. Melansir dari Center for Disease Control and Prevention (CDC), orang tua yang memiliki kesehatan mental yang buruk memiliki anak dengan kesehatan yang buruk pula. Seperti cacat mental, emosional, atau perkembangan yang terhambat. Seperti efek domino, hal ini bahkan bisa berdampak pada keharmonisan keluarga, seperti perceraian dan trauma. Sebetulnya, tiap orang tua perlu mencoba untuk tidak menekan diri sendiri untuk menjadi “orang tua yang sempurna”. Pahamilah bahwa semua orang tua mengalami masa-masa sulit, dan mereka tidak perlu malu untuk mencari bantuan. Konsistenlah dengan waktu yang teratur, terutama waktu makan dan waktu tidur. Dua hal ini pun dapat membuat ayah dan ibu lebih nyaman, dan anak pun merasa lebih aman. Orang tua perlu terhubung dengan orang terdekat yang dapat diandalkan untuk membantu saat diperlukan sewaktu-waktu. Beri tahu mereka apa yang perlu dibantu, entah itu membantu mengantar atau menjemput anak, atau bahkan menjaga anak selagi ada keperluan. Jika masalah kesehatan mental terasa sulit diatasi sendiri, tidak ada salahnya untuk meminta bantuan profesional seperti psikolog"
"Sering Diabaikan, Ini Pentingnya Menjaga Kesehatan Mental Anak",,,https://www.halodoc.com/artikel/sering-diabaikan-ini-pentingnya-menjaga-kesehatan-mental-anak,,,,,,"Sangat mudah bagi orangtua untuk mengidentifikasi kebutuhan fisik anak mereka. Memberikan makanan bergizi, pakaian hangat saat cuaca dingin, waktu tidur pada jam yang wajar. Namun, mengidentifikasi kebutuhan mental dan emosional anak ternyata tidak semudah memenuhi kebutuhan fisik mereka. Padahal, menjaga kesehatan mental anak sama pentingnya dengan kesehatan fisik mereka. Sebenarnya, mengapa menjaga kesehatan mental anak jadi hal penting yang harus diperhatikan oleh kedua orangtua? Bukan tanpa alasan, kesehatan mental yang baik dan terjaga memungkinkan anak untuk berpikir jernih, berkonsentrasi, berkembang lebih baik secara sosial dan lebih mudah mempelajari keterampilan baru. Selain itu, peran orangtua dan orang terdekat, seperti guru dan teman sama pentingnya untuk membantu anak mengembangkan rasa percaya diri, harga diri yang tinggi, dan pandangan emosional yang sehat tentang kehidupan. Menurut Organisasi Kesehatan Dunia (WHO), sebanyak 10 sampai 20 persen anak-anak dan remaja mengalami gangguan mental, seperti dilansir dari laman Positive Psychology. Sebanyak 50 persen dari semua penyakit mental dimulai pada usia 14 tahun. Sementara itu, sebanyak 75 persen terjadi pada pertengahan usia 20-an. Kondisi neuropsikiatri diyakini menjadi penyebab utama masalah kesehatan mental pada anak. Kondisi atau gangguan neuropsikiatri adalah istilah luas yang digunakan menggambarkan penyakit yang secara negatif mempengaruhi kemampuan seseorang untuk belajar, bekerja, dan mengatasi emosi. Kaitan umumnya adalah bahwa jenis gangguan ini memengaruhi fungsi otak, emosi, dan suasana hati. Sayanya, masalah kesehatan mental pada anak justru mengalami peningkatan seiring waktu. Kondisi seperti ADHD, masalah perilaku, kecemasan dan depresi menjadi masalah kesehatan mental yang paling sering didiagnosis. Bahkan, beberapa kondisi sering terjadi secara bersamaan. Misalnya, seorang anak didiagnosis mengalami depresi dan gangguan kecemasan. Jadi, daripada menyuruh seorang anak untuk bersikap berani, kuat, teguh, atau lainnya, akan lebih baik jika sebagai orangtua, ayah dan ibu memberikan dampingan dan bantuan untuk dapat menumbuhkan energi yang positif. Dengan melakukan hal tersebut, secara tidak langsung ibu dan ayah telah turut serta dalam memberikan dukungan positif terhadap generasi mendatang. Agar anak memiliki kehidupan sosial dan emosional yang lebih baik, penting untuk orangtua menjaga kesehatan mentalnya sejak dini. Rasa cinta, rasa aman dan perasaan diterima harus menjadi inti kehidupan keluarga. Anak-anak perlu tahu bahwa cinta orangtuanya tidak bergantung pada apa saja yang sudah berhasil dicapai. Kesalahan kekalahan harus bisa diterima. Sebab, rasa yakin akan tumbuh di dalam rumah yang penuh dengan cinta dan kasih sayang tanpa syarat. Bagi anak-anak, bermain menjadi aktivitas yang paling menyenangkan. Namun, waktu bermain sama pentingnya dengan perkembangan mereka seperti halnya makan. Waktu bermain membantu anak-anak menjadi lebih kreatif, belajar keterampilan baru dalam memecahkan masalah dan belajar untuk mengendalikan diri. Permainan yang baik dan kuat, termasuk berlari dan berteriak tidak hanya menjadi aktivitas yang menyenangkan, tetapi juga membantu anak-anak menjadi sehat secara fisik dan mental. Tak banyak orangtua yang menyadari bahwa anak-anak perlu memiliki waktu bersama dengan teman sebayanya. Bermain dengan orang lain akan membuat anak mampu menemukan kelebihan dan kelemahan mereka, mengembangkan rasa memiliki. Mereka juga dapat belajar bagaimana bergaul dengan orang lain. Pertimbangkan untuk menemukan program anak-anak yang baik melalui tetangga, pusat komunitas lokal, sekolah, atau departemen taman dan rekreasi setempat. Anak-anak membutuhkan kesempatan mengeksplorasi dan mengembangkan keterampilan dan kemandirian baru. Anak-anak juga perlu belajar bahwa perilaku tertentu tidak dapat diterima dan bahwa mereka bertanggung jawab atas konsekuensi dari tindakan mereka. Sebagai anggota keluarga, anak perlu mempelajari aturan yang dibuat ayah dan ibu dalam keluarga. Jadi, pastikan ibu memberikan bimbingan dan disiplin yang adil dan konsisten. Nantinya, anak akan membawa keterampilan sosial dan aturan perilaku ini ke sekolah dan akhirnya ke tempat kerja. "
"Waspada, Ini 5 Tanda Kelelahan Mental",,,https://www.halodoc.com/artikel/waspada-ini-5-tanda-kelelahan-mental,,,,,,"Jika kamu merasa kelelahan, tidak berenergi dan kesulitan tidur, sebaiknya kamu patut waspada. Sebab, kondisi tersebut bisa jadi merupakan indikasi akan terjadinya kelelahan mental telah terjadi pada dirimu. Perlu diketahui bahwa kelelahan mental merupakan kondisi di mana seseorang merasakan kondisi kelelahan secara emosional akibat kondisi kehidupannya. Berita buruknya, kondisi tersebut dapat dialami oleh siapa saja. Tentunya, kondisi ini perlu dideteksi sedari dini agar dapat diatasi dengan tepat. Tidak ada salahnya kenali tandanya lebih banyak agar kamu mendapatkan penanganan tepat dan terhindar dari gangguan kesehatan mental yang lebih serius. Maka dari itu, ketahuilah beberapa tanda kelelahan mental yang perlu diwaspadai. Penasaran apa saja? Yuk simak infonya di sini! Bukan hanya saat pandemi, kelelahan mental bisa dialami oleh siapa saja dalam keadaan apapun. Hal ini bisa terjadi akibat adanya kondisi atau situasi yang menyebabkan stres dalam jangka panjang. Biasanya, saat mengalami kelelahan mental, seseorang akan merasa terperangkap dalam satu situasi sulit dan tidak memiliki kekuatan atau daya untuk mengatasinya. Ada berbagai tanda yang perlu kamu waspadai terhadap kondisi kelelahan mental. Kondisi tersebut dapat menyebabkan berbagai gejala pada pengidapnya, seperti: Saat mengalami kelelahan mental, kamu akan lebih mudah kehilangan motivasi atas apa yang akan dikerjakan. Selain itu, kamu juga akan merasa hasil yang kamu kerjakan pasti akan buruk, meskipun kamu telah mengerjakannya dengan sebaik mungkin. Saat kamu merasa kondisi stres yang tidak kunjung reda, bisa jadi ini tanda dari kelelahan mental yang kamu alami. Kelelahan mental yang tidak segera diatasi dapat menyebabkan kamu lebih mudah tersinggung. Bahkan, terhadap hal-hal kecil yang biasanya dianggap wajar. Sikap mudah tersinggung ini juga membuat kamu kerap meledakkan amarah dan putus asa. Mental yang lelah juga berkaitan langsung dengan fisik. Kondisi ini meningkatkan risiko kelelahan fisik, gangguan tidur, hingga nyeri sendi dan otot. Tidak jarang, kelelahan mental yang tidak diatasi dapat menyebabkan kamu mengalami sakit kepala. Terlalu banyak situasi yang membuat tekanan nyatanya dapat membuat kamu kesulitan untuk berkonsentrasi. Cobalah untuk mengatasi situasi secara perlahan agar kamu dapat mengerjakan dan mengatasi semuanya dengan lebih baik dan penuh konsentrasi. Itulah beberapa tanda yang perlu kamu waspadai terkait dengan kelelahan mental. Jangan abaikan gejala yang berlangsung cukup lama. Apalagi jika kamu sudah berpikir untuk melakukan tindakan bunuh diri. Segera minta bantuan pada tim medis agar kamu mendapatkan penanganan yang tepat untuk mengatasi setiap permasalahan yang kamu hadapi. Selain pengobatan yang dilakukan bersama dengan tim medis, kamu bisa melakukan berbagai cara di rumah untuk membantu pengobatan berjalan maksimal. Saat kamu mengalami kelelahan mental, jangan lupa siapkan waktu untuk berolahraga. Mengapa olahraga dapat memperbaiki kondisi mental? Olahraga dinilai cukup efektif untuk meningkatkan hormon endorphin dan serotonin yang berfungsi membuat suasana hati menjadi lebih baik. Lakukan olahraga ringan dan menyenangkan agar manfaat olahraga dapat kamu rasakan dengan maksimal. Tidak hanya olahraga fisik, kamu juga bisa melakukan kegiatan yang menenangkan. Misalnya, meditasi, yoga, atau mencari teman yang kamu percaya untuk bercerita. Hal ini cukup membantu mengatasi stres maupun kelelahan mental yang kamu alami. Di samping itu, mengonsumsi makanan sehat menjadi salah satu perawatan yang bisa kamu lakukan untuk mengatasi kelelahan mental yang kamu rasakan. Sebaiknya pastikan kamu mengonsumsi buah, sayur, dan makanan sehat lainnya secara seimbang. Pastikan kamu membatasi asupan gula atau makanan cepat saji. "
Cek Fakta: Dampak Kelelahan pada Kesehatan Mental Karyawan,,,https://www.halodoc.com/artikel/cek-fakta-dampak-kelelahan-pada-kesehatan-mental-karyawan,,,,,,"Berbicara tentang lingkungan kerja tidak hanya seputar tenggat pekerjaan yang harus diselesaikan setiap harinya. Pemangku kepentingan bisnis, termasuk atasan juga harus memperhatikan kondisi kesehatan para karyawan, baik itu fisik, terlebih kesehatan mental. Siapa sangka, karyawan akan merasa sangat dihargai berdampak positif terhadap kesehatan mental mereka, lho! Tidak harus muluk, cukup dengan memahami kondisi kesehatan para karyawan, apa yang mereka butuhkan dalam pekerjaan, atau menjalin komunikasi yang baik sudah cukup untuk membuat karyawan merasa nyaman. Terlebih jika perusahaan memberikan kemudahan, seperti jaminan asuransi kesehatan, bonus tahunan, kenaikan gaji, waktu istirahat yang cukup, dan jam kerja yang fleksibel. Tidak dapat dimungkiri bahwa bekerja memang menjadi salah satu rutinitas yang begitu menyita energi dan pikiran. Apalagi jika seorang karyawan menerima banyak sekali tuntutan, seperti tidak boleh terlambat, ancaman pemotongan gaji jika terlambat, tenggat pekerjaan yang sangat ketat, belum lagi semua tugas kantor lainnya. Bukan tidak mungkin karyawan akan merasa begitu lelah. Sayangnya, masih banyak yang belum menyadari bahwa kelelahan pada karyawan membawa dampak yang cukup signifikan terhadap kesehatan mental mereka. Pekerja yang mengalami kelelahan disebut merasa stres, depresi, penurunan produktivitas, hingga keinginan untuk tidak masuk kerja karena ingin beristirahat dan munculnya perilaku negatif di lingkungan pekerjaan. Secara tidak langsung, kelelahan yang dialami para pekerja akan memengaruhi retensi pekerja dengan signifikan. Tentunya, hal ini pun akan berdampak pada kesuksesan perusahaan secara menyeluruh. Terlebih di masa pandemi yang erat kaitannya dengan penurunan aspek bisnis dan berdampak pada tingginya angka pemutusan hubungan kerja. Ini dapat memunculkan rasa takut, cemas, gelisah, dan rasa sedih yang besar. Pandemi yang telah berlangsung selama dua tahun ini memang membawa perubahan yang begitu signifikan terhadap berbagai aspek kehidupan. Tak hanya kehilangan pekerjaan, orang-orang juga kehilangan sanak saudara, bahkan tidak dapat turut mengantar ke tempat peristirahatan terakhirnya karena harus mengisolasi diri. Tentunya, hal-hal ini akan semakin meningkatkan kadar kecemasan, sedih, stres, dan depresi pada masyarakat. Beruntungnya, beberapa pemilik usaha telah melihat hal ini sebagai suatu kondisi yang penting dan harus diperhatikan. Perubahan kebijakan pun akhirnya dilakukan, salah satunya dengan pengaturan waktu kerja yang lebih fleksibel, memberikan tunjangan kesehatan dan kebugaran pada para karyawan, juga mengeluarkan aturan untuk bekerja secara remote dengan batasan dan aturan tertentu. Dengan demikian, diharapkan tingginya tingkat stres dan masalah kesehatan mental lainnya pada karyawan bisa berkurang dan produktivitas mereka pun akan menjadi lebih baik lagi, sehingga keuntungan bisnis tetap bisa tercapai. Secara sederhana, para pekerja dapat merasa bahwa dirinya aman dengan adanya perlindungan dalam kondisi darurat, penyakit yang tidak terduga, hingga musibah. "
