Judul_Artikel,,,Link_Artikel,,,,,,Isi_Artikel
Pentingnya Menjaga Kesehatan Mental Pekerja Selama WFH,,,https://www.halodoc.com/artikel/pentingnya-menjaga-kesehatan-mental-pekerja-selama-wfh,,,,,,"Jika kamu membaca artikel ini, maka kemungkinan besar kamu masih harus melakukan semua pekerjaan kantor dari rumah atau work from home (WFH). Sebelum pandemi COVID-19 dimulai, bekerja dan berbisnis dari rumah mungkin tampak hal yang tidak mungkin. Namun, kini sebagian besar pekerja menghabiskan waktunya di rumah untuk bekerja sesuai arahan pemerintah setempat. Mungkin bagi sebagian orang, bekerja di rumah atau WFH, bukanlah hal yang ideal. Sebab, pasti ada saja halangan yang membuat WFH yang seharusnya terasa lebih mudah menjadi hal yang penuh dengan tantangan dan membuatnya stres. Oleh karena itu, berikut ini adalah cara agar para karyawan yang sedang menjalani WFH bisa bekerja lebih produktif dan tetap memiliki kondisi mental yang baik: Saat WFH dan tidak memiliki rutinitas yang benar, maka kamu bisa jatuh ke dalam banyak kebiasaan buruk seperti bangun terlambat, terganggu oleh hal-hal seperti smartphone, atau bahkan bekerja terlalu keras hingga larut malam. Coba buat struktur dan rutinitas yang dapat kamu patuhi, dan jangan lupa masukan waktu untuk beristirahat juga untuk waktu pribadimu. Sangat penting untuk menjaga rutinitas harian normal seperti saat sedang bekerja di kantor. Lakukan juga tugas-tugas sederhana lain, seperti merapikan tempat tidur, mengenakan pakaian yang nyaman, atau bahkan mendengarkan podcast atau musik yang biasanya kamu dengarkan selama perjalanan. Supaya kamu bisa memanfaatkan waktu sebaik mungkin, pastikan kamu memiliki catatan mengenai pekerjaan apa saja yang paling penting dan harus segera dikerjakan. Dengan memiliki jadwal yang teratur, maka kamu bisa terhindar dari overtime yang seharusnya bisa dihindarkan sehingga kesehatan mental juga bisa terjaga. Selain itu, pastikan juga untuk memasukkan jadwal olahraga, jalan-jalan pagi, atau hal-hal pribadi lainnya untuk mengimbangi pekerjaan kantor. Siapkan ruangan kerja yang nyaman, atau kamu juga bisa membuat ruang tidur kamu menjadi ruang kerja dengan sedikit pengaturan. Penting juga untuk memiliki meja dan kursi khusus, dan hindari bekerja dari kasur. Karena ini bisa membuatmu jadi cepat mengantuk atau tidak fokus. Selain itu, coba dengarkan musik dengan volume rendah untuk membantu tetap fokus. Faktanya, dengan istirahat yang cukup, maka ini bisa membuat kamu tetap produktif , termotivasi saat bekerja, dan menjaga kesehatan mental. Jadi, pastikan untuk beristirahatlah demi kesehatan fisik dan mental. Berjalan santai atau berhenti sejenak untuk melakukan olahraga yoga juga bisa membantu untuk kembali fokus, mengelola kecemasan, dan tetap produktif. Bekerja di rumah bisa sangat membuat kamu merasa kesepian dan mengganggu kesehatan mental. Oleh karena itu, selagi menghadiri rapat online, jangan lupa sapa rekan-rekan kerja. Kamu juga bisa sesekali mengajak teman untuk mengobrol lewat Zoom atau Google Meet sembari bekerja bersama. Rutinitas itu penting, tetapi punya waktu istirahat di penghujung hari juga penting agar kamu tidak kelelahan. Begitu juga saat kamu sedang merasa tidak sehat, meminta izin kepada atasan untuk beristirahat hingga kondisi kembali membaik. Ingat, keseimbangan kehidupan kerja itu penting."
Tips Mengelola Kesehatan Mental Kucing Kesayangan,,,https://www.halodoc.com/artikel/tips-mengelola-kesehatan-mental-kucing-kesayangan,,,,,,"Banyak pemilik kucing yang hanya fokus pada kesehatan fisik hewan kesayangannya saja. Padahal, kesehatan mental kucing juga perlu diperhatikan, lho. Sama halnya seperti manusia, masalah kesehatan mental pada kucing juga bisa berakibat buruk. Jadi, sebagai pemilik kucing yang bertanggung jawab, kamu perlu mengetahui cara mengelola kesehatan mental kucing dengan baik. Bagaimana caranya? Yuk simak lebih lanjut! Menjaga kesehatan mental kucing sama pentingnya dengan memerhatikan asupan makanan, vaksinasi, dan perawatan fisik. Berikut ini tips untuk membuat mental hewan kesayangan kamu selalu terjaga: Hal pertama yang perlu dilakukan ketika mengadopsi kucing adalah, posisikan diri kamu sebagai orangtua mereka. Bagai orangtua ke anak, kamu akan memerhatikan semua kebutuhannya, membuatnya nyaman, dan menghujaninya dengan cinta. Kucing yang merasa dicintai penuh oleh pemiliknya akan merasa nyaman dan aman. Ia jadi merasa seperti punya orangtua yang selalu melindungi dan menyayanginya. Ini akan membuatnya bahagia dan tidak mudah stres. Setiap kucing memiliki kepribadian yang berbeda. Ini biasanya menjadi jelas ketika kamu mempelajari pola perilaku mereka. Sangat penting untuk memahami kucing kesayangan kamu dengan baik. Ini dapat membantu mengeratkan koneksi atau ikatan batin yang terjalin antara kamu dan kucing. Setelah mengetahui kepribadian kucing, kamu mungkin jadi tahu kapan mereka butuh waktu untuk sendiri. Sama halnya seperti manusia, kucing juga bisa merasa ingin sendirian sesekali, dan kembali bersama kamu saat merasa sudah membaik. Meski menghabiskan sebagian besar waktunya di rumah, kucing pada dasarnya adalah predator alami di alam liar. Jadi, pahamilah bahwa mereka punya kebutuhan untuk berburu dan mengintai mangsa, sebagai naluri dasar mereka. Biarkanlah kucing berburu sesekali, atau bermain kejar-kejaran. Ini akan membantu menjaga kesehatan mental kucing. Kebosanan bisa menyebabkan masalah perilaku dan berat badan. Jadi, cobalah untuk memperkenalkan aktivitas baru kepada kucing untuk membuatnya aktif. Setiap hewan perlu memiliki interaksi sosial di antara jenisnya. Berinteraksi secara sosial dengan kucing lain adalah hal yang perlu dijaga. Namun, kamu juga perlu hati-hati agar kucing tidak jadi terlalu terikat dengan kucing lain. Sebab, jika ini terjadi, suasana hati kucing akan dipengaruhi oleh kucing lain dan ini bisa merepotkan. Interaksi sosial dengan kucing lain selama seminggu sekali sudah cukup untuk membuat kucing puas secara sosial. Setiap kucing memiliki perilaku aneh yang terkadang dapat menyebabkan pemiliknya kesal dan frustrasi. Penting untuk mengetahui mengapa kucing melakukan hal-hal tertentu yang menurut kamu aneh. Ketika kamu menemukan penyebab masalah, atasi masalah dengan tepat dan bijaksana. Penting untuk membuat langkah yang benar saat mendisiplinkan kucing. Menghukum kucing sering kali memiliki efek negatif karena dapat membuat mereka merasa tidak aman dan takut. Jadi, jangan pernah menghukum kucing tanpa mengetahui penyebab sebenarnya. Ini dapat memperburuk situasi dan seringkali dapat menyebabkan fobia. "
Pengaruh Screen Time pada Kesehatan Mental Anak,,,https://www.halodoc.com/artikel/pengaruh-screen-time-pada-kesehatan-mental-anak-1,,,,,,"Screen time disebut bisa memengaruhi kondisi kesehatan mental anak. Konsep screen time digunakan untuk menggambarkan waktu ketika orangtua membebaskan Si Kecil untuk mengakses gadget atau menonton televisi. Lantas, benarkah hal ini bisa memengaruhi kondisi kesehatan mental anak? Mengapa kedua hal tersebut bisa berkaitan? Melansir Psychology Today, ada penelitian yang menyebut bahwa kebiasaan menggunakan gadget atau menonton televisi bisa meningkatkan risiko terjadinya gangguan mental, seperti depresi pada anak. Meskipun begitu, masih sedikit bukti terhadap hal tersebut serta kaitan antara penggunaan perangkat elektronik dan kesehatan mental disebut tidak terlalu besar. Meski belum terbukti pasti bahwa menghabiskan waktu dengan perangkat elektronik bisa memengaruhi kesehatan mental anak, hal ini tetap harus diwaspadai. Maka dari itu, orangtua disarankan untuk menaruh perhatian pada waktu yang dihabiskan Si Kecil untuk bermain gadget. Hal ini memang bisa menjadi sarana hiburan, bahkan edukasi, tetapi sebaiknya tidak dilakukan secara berlebihan. Saran ahli, anak-anak sebaiknya hanya diberikan waktu beberapa jam dalam sehari untuk menggunakan perangkat elektronik. Bahkan, sebaiknya tidak lebih dari 2 jam. Selain itu, hindari membiarkan anak mengakses gadget pada malam hari atau mendekati waktu tidur. Sebab, hal ini mungkin memicu terjadinya gangguan tidur dan mengacaukan pola tidur Si Kecil. Kalau sudah begitu, risiko terjadinya masalah pada kesehatan fisik dan mental bisa meningkat. Terlalu lama menghabiskan waktu di depan perangkat elektronik juga bisa membuat anak-anak kurang aktif bergerak. Dengan kata lain, screen time yang tidak dibatasi bisa meningkat risiko Si Kecil mengalami gaya hidup sedentari. Membiarkan anak terlalu lama menghabiskan waktu di depan layar bisa memicu gaya hidup sedentari. Anak-anak akan menjadi semakin malas bergerak, sebab waktunya banyak tersita dengan perangkat elektronik. Jika tubuh tidak aktif bergerak, risiko terjadinya penyakit fisik maupun mental akan menjadi lebih besar. Selain itu, anak-anak juga cenderung akan terisolasi dengan “dunia digital” sehingga mungkin tidak memiliki pergaulan di dunia nyata lagi. Seperti dikatakan sebelumnya, anak-anak yang terlalu lama menghabiskan waktu di depan gadget berisiko mengalami gangguan tidur di malam hari. Saat tubuh tidak mendapatkan waktu istirahat yang cukup, ditambah aktivitas fisik yang minim, risiko penyakit akan menjadi lebih besar. Kondisi ini juga bisa menyebabkan Si Kecil mengalami masalah pada kesehatan mental, misalnya depresi. Risiko gangguan kesehatan mental juga terkait dengan kemungkinan terjadinya kecanduan game, yang oleh WHO sudah dinyatakan sebagai sebuah penyakit. Kendati begitu, perangkat elektronik tidak melulu berdampak negatif. Jika digunakan dengan bijaksana, nyatanya gadget maupun televisi bisa memberikan manfaat yang luar biasa untuk perkembangan anak. Seiring berkembangnya teknologi, tentu orangtua tidak ingin Si Kecil mengalami kesulitan menjalani kehidupannya kelak. Sebagian besar sektor, termasuk pendidikan dan pekerjaan pun sudah berbasis teknologi. Maka dari itu, cara terbaik untuk memastikan screen time tidak berdampak buruk pada kesehatan mental anak adalah dengan membatasi penggunaan harianya sedini mungkin. "
4 Cara Tingkatkan Serotonin untuk Mental yang Sehat,,,https://www.halodoc.com/artikel/4-cara-tingkatkan-serotonin-untuk-mental-yang-sehat,,,,,,"Kesehatan mental sangat penting untuk dijaga karena jika terganggu, dampaknya juga dapat memengaruhi kesehatan fisik. Ada banyak cara yang dapat dilakukan agar senantiasa memiliki mental yang sehat. Salah satu cara yang dapat kamu lakukan adalah dengan meningkatkan hormon serotonin di dalam tubuh. Serotonin adalah hormon yang bertugas untuk membawa pesan antar sel dalam otak. Hormon ini berperan penting dalam memperbaiki suasana hati menjadi lebih baik, sehingga kamu jadi merasa bahagia. Seseorang yang kekurangan hormon serotonin dapat membuat suasana hatinya menjadi buruk. Jika hal ini dibiarkan, tentunya lama-kelamaan kesehatan mental dapat terganggu. Oleh karena itu, setiap orang perlu meningkatkan kadar hormon serotonin agar mental tetap sehat. Sebenarnya, hormon serotonin dapat ditingkatkan dengan konsumsi obat-obatan. Namun secara jangka panjang, bukan tidak mungkin ada risiko kesehatan dan masalah ketergantungan. Langkah yang lebih baik yang dapat dilakukan adalah dengan meningkatkan hormon serotonin secara alami. Tentu saja cara ini tanpa efek samping dan bahkan menyehatkan tubuh. Salah satu cara yang dapat dilakukan untuk meningkatkan hormon serotonin secara alami adalah dengan lebih banyak konsumsi makan dengan kandungan triptofan. Namun, efek ini tidak didapat secara langsung karena membutuhkan makanan lain yang kaya karbohidrat. Kandungan karbohidrat yang sudah berbentuk gula dapat menyebabkan produksi insulin lebih banyak. Dikutip dari sebuah penelitian yang dipublikasikan di Journal of Nutrition and Food Sciences, insulin mampu mempercepat penyerapan asam amino tetapi triptofan tetap di dalam darah. Lalu, zat tersebut diserap oleh otak dan digunakan untuk memproduksi serotonin. Nah, beberapa makanan yang kaya akan kandungan triptofan adalah salmon, telur, dan keju. Namun tetap perhatikan porsi yang kamu konsumsi. Cara lainnya untuk meningkatkan hormon serotonin di dalam tubuh dengan alami adalah melakukan olahraga secara rutin. Dipercaya jika olahraga dapat memicu pelepasan triptofan ke dalam darah. Selanjutnya, otak akan menyerap dan menghasilkan serotonin. Disebutkan jika latihan aerobik sangat baik untuk hal ini, seperti dansa, sepatu roda, renang, bersepeda, dan joging. ika kamu merasa membutuhkan asupan hormon serotonin, pijat dapat menjadi solusi. Bukan hanya serotonin, dopamin dan neurotransmitter lain yang berhubungan dengan suasana hati juga dapat diproduksi. Cara ini membantu tubuh untuk mengurangi kortisol, hormon yang dihasilkan tubuh saat stres. Penurunan kortisol berarti naiknya kadar serotonin. Pijat dapat menjaga kesehatan mental dengan meningkatkan kadar serotonin dan menurunkan kadar kortisol karena perasaan rileks yang dirasakan. Selain itu, pijat juga dapat meningkatkan kesadaran antara pikiran dan tubuh. Maka dari itu, kamu disarankan untuk mendapatkan pijatan paling tidak seminggu sekali agar tubuh terasa rileks dan jauh dari masalah mental. Cara paling akhir yang bisa dilakukan untuk meningkatkan hormon serotonin agar dijauhi dari masalah mental adalah dengan menggunakan minyak esensial. Dikutip dari penelitian yang dipublikasikan dalam Frontiers in Pharmacology, disebutkan bahwa minyak esensial dapat meningkatkan hormon serotonin dan membuat mood jadi lebih baik. Nah, cobalah untuk gunakan minyak esensial secara rutin. Itulah cara meningkatkan serotonin secara alami, yang bisa kamu coba. Dengan meningkatnya hormon serotonin di dalam tubuh, kamu dapat terjauhi dari gangguan mental seperti stres dan bahkan depresi. Bukan hanya fisik yang perlu dijaga kesehatannya, mental pun perlu. Bahkan gangguan mental juga dapat memengaruhi kesehatan fisik seseorang."
Ini Manfaat Rutin Olahraga untuk Kesehatan Mental,,,https://www.halodoc.com/artikel/ini-manfaat-rutin-olahraga-untuk-kesehatan-mental,,,,,,"Manfaat olahraga nyatanya tidak semata-mata untuk memperbesar kapasitas aerobik dan ukuran otot. Tentunya olahraga dapat meningkatkan kesehatan fisik, membantu mengecilkan lingkar pinggang, meningkatkan kualitas kehidupan seksual, bahkan memperpanjang usia. Namun, bukan itu yang memotivasi kebanyakan orang untuk tetap olahraga. Orang yang berolahraga secara teratur cenderung melakukannya karena aktivitas ini memberikan mereka rasa sejahtera yang luar biasa. Mereka merasa lebih energik sepanjang hari, tidur lebih nyenyak di malam hari, memiliki ingatan yang lebih tajam, dan merasa lebih santai dan positif tentang diri dan kehidupan mereka. Jadi bisa dikatakan bahwa olahraga membawa banyak manfaat untuk kesehatan mental secara umum. Kamu tak perlu jadi anggota klub kebugaran untuk mendapatkannya, sebab sedikit olahraga saja asal dilakukan rutin bisa memberikan manfaat yang luar biasa. Lantas, bagaimana cara olahraga dalam memperbaiki kesehatan mental? Berikut ulasannya! Studi menunjukkan bahwa olahraga dapat mengobati masalah kesehatan mental seperti depresi ringan hingga sedang seefektif obat antidepresan, dan hebatnya tanpa efek samping. Seperti dalam penelitian yang dipublikasikan di Harvard T.H. Chan School of Public Health menemukan bahwa berlari selama 15 menit sehari atau berjalan selama satu jam mengurangi risiko depresi berat sebesar 26 persen. Selain meredakan gejala depresi, penelitian juga menunjukkan bahwa menjaga jadwal olahraga dapat mencegah kekambuhan. Olahraga adalah obat depresi yang ampuh karena beberapa alasan. Hal yang paling penting, aktivitas ini mempromosikan semua jenis perubahan di otak, termasuk pertumbuhan saraf, mengurangi peradangan, dan pola aktivitas baru yang meningkatkan perasaan tenang dan sejahtera. Olahraga juga akan melepaskan endorfin, bahan kimia kuat di otak yang memberi energi pada semangat dan membuat kamu merasa baik. Akhirnya, olahraga juga dapat berfungsi sebagai pengalih perhatian, memungkinkan pengidap depresi untuk menemukan waktu tenang agar bisa keluar dari siklus pikiran negatif yang merupakan penyebab depresi. Olahraga juga obat anti-kecemasan yang alami dan efektif sehingga baik untuk kesehatan mental. Ini mengurangi ketegangan dan stres, meningkatkan energi fisik dan mental, dan meningkatkan kesejahteraan melalui pelepasan endorfin. Selain itu, para pengidap kecemasan juga bisa mencoba untuk memperhatikan hal-hal di sekitar. Seperti sensasi kaki saat menyentuh tanah, misalnya, atau ritme pernapasan, atau perasaan angin di kulit. Dengan lebih peka terhadap sekitar, maka kamu bisa benar-benar berfokus pada tubuh dan merasakan rasanya saat berolahraga. Jadi, ini tidak hanya akan meningkatkan kondisi fisik, tetapi juga dapat menghentikan aliran kekhawatiran yang terus-menerus mengalir di kepala. Pernah memperhatikan bagaimana perasaan tubuh ketika sedang stres? Otot-otot mungkin tegang, terutama di wajah, leher, dan bahu, sehingga membuat kamu jadi sakit punggung atau leher, atau sakit kepala yang menyakitkan. Kamu juga mungkin merasakan sesak di dada, denyut nadi berdebar, atau kram otot. Kamu juga mungkin mengalami masalah, seperti insomnia, mulas, sakit perut, diare, atau sering buang air kecil. Kekhawatiran dan ketidaknyamanan dari semua gejala fisik ini pada gilirannya dapat menyebabkan lebih banyak stres, menciptakan lingkaran setan antara pikiran dan tubuh. Dengan berolahraga, siklus ini akan terputus. Manfaat olahraga untuk kesehatan mental tidak hanya membantu melepaskan endorfin di otak, aktivitas fisik akan membantu mengendurkan otot dan meredakan ketegangan di tubuh. Karena tubuh dan pikiran sangat terkait erat, maka ketika tubuh merasa lebih baik, pikiran juga akan ikut membaik. "
Nike Liburkan Seminggu Karyawannya Demi Jaga Kesehatan Mental,,,https://www.halodoc.com/artikel/nike-liburkan-seminggu-karyawannya-demi-jaga-kesehatan-mental,,,,,,"Perusahaan besar yang berfokus pada sportswear, Nike, dikabarkan telah memberikan cuti kepada karyawan kantor pusatnya di Amerika Serikat selama seminggu penuh. Cuti ini pun diberikan dengan dalih untuk “menghilangkan stres” dan pulih dari tekanan pandemi COVID-19. Selain telah menerapkan aturan cuti selama sepekan, para pemimpin senior perusahaan juga mendorong staf mereka untuk mengabaikan semua tanggung jawab kerja untuk membantu kesehatan mental mereka. Matt Marrazzo selaku Manajer Senior Pemasaran Global Nike pun meminta para karyawannya untuk meluangkan waktu bersantai, menghilangkan stres, dan menghabiskan waktu bersama orang yang dicintai, dan yang terpenting jangan bekerja. Sejak ditetapkan sebagai pandemi oleh WHO pada Maret 2020 silam, tak dapat dimungkiri bahwa tingkat kesejahteraan mental setiap orang mengalami penurunan. Satu setengah tahun ini memang bukan waktu yang mudah untuk dijalani, dan tidak ada seorang pun yang tahu kapan situasi bisa benar-benar kembali normal. Oleh karena itu, meluangkan waktu untuk istirahat dan pemulihan adalah kunci agar bisa tetap sehat dan waras. Dengan memberikan kebijakan cuti selama seminggu penuh, ini menempatkan Nike di antara semakin banyak bisnis yang menawarkan waktu istirahat ekstra, atau konsesi seputar tanggung jawab kerja. Langkah ini dilakukan semata-mata untuk memerangi kelelahan yang disebabkan oleh pekerjaan rumahan dan video conference terus-menerus yang mengaburkan batasan antara kehidupan pribadi dan profesional. Matt Marrazzo juga mengatakan bahwa cuti ini sebagai bentuk tunjangan dan dukungan untuk semua staf di kantor pusat Nike. Bagi mereka, ini bukan hanya pemberian libur seminggu untuk tim, tetapi ini adalah pengakuan bahwa Nike dapat memprioritaskan kesehatan mental dan tetap bisa menyelesaikan pekerjaan. Ingat, tidak ada satu pun orang yang bisa bekerja tanpa henti dan tetap produktif, terutama dalam konteks pandemi global. Kamu butuh istirahat sebelum mengalami stres atau bahkan depresi. Meskipun mungkin bukan liburan ke luar negeri yang kamu sangat harapkan, mengambil cuti untuk istirahat dari pekerjaan tidak hanya menyenangkan untuk dimiliki, tetapi juga penting untuk kesehatan mental secara keseluruhan. Ada baiknya kamu mulai ambil cuti atau merencanakan waktu untuk cuti dari jauh-jauh hari sebelum kamu mengalami burn-out akibat pekerjaan dan situasi pandemi. Nah, berikut ini beberapa gejala yang bisa menjadi tanda bahwa kamu perlu segera untuk istirahat dan cuti: Setiap orang membutuhkan istirahat, tetapi mungkin sulit untuk mengenali kapan saatnya untuk berhenti sejenak. Jika kamu merasa sedikit aneh atau melakukan hal-hal yang berbeda dari biasanya, kamu mungkin perlu istirahat dari kesibukan sehari-hari. "
Olahraga Lari Bisa Bantu Menjaga Kesehatan Mental,,,https://www.halodoc.com/olahraga-lari-bisa-bantu-menjaga-kesehatan-mental,,,,,,"Lari adalah salah satu olahraga yang terbilang mudah untuk dilakukan karena tidak membutuhkan banyak peralatan. Olahraga ini juga dapat menyehatkan tubuh, bukan hanya secara fisik tetapi juga pada mental seseorang. Namun, bagaimana caranya olahraga jenis ini dapat membuat mental kamu lebih sehat? Untuk mengetahui jawabannya, baca selengkapnya uraian ini! Latihan fisik apa pun itu memiliki banyak manfaat bagi kesehatan. Saat kamu berolahraga dengan cara berlari, maka endorfin dan serotonin, yaitu zat kimia di otak yang dapat meningkatkan suasana hati, dilepaskan oleh tubuh. Dengan berlari secara teratur, dapat memberikan dorongan yang konsisten terhadap rasa bahagia, sehingga tubuh dan pikiran menjadi lebih baik. Salah satu manfaat lari sehingga baik untuk kesehatan mental adalah mampu mengurangi perasaan stres yang dirasakan. Hal ini disebabkan endocannabinoid yang dilepaskan oleh tubuh yang merupakan zat biokimia yang mirip dengan konsumsi ganja. Zat kimia ini diproduksi secara alami di dalam tubuh dan menyebar di aliran darah hingga ke otak. Hal ini dapat memberikan mengurangi perasaan stres dalam jangka pendek dan menenangkan. Berlari dapat menjaga kesehatan mental dengan cara mengurangi rasa cemas dan depresi. Saat berlari, sirkulasi darah ke otak meningkat dan bagian otak dapat merespons stres sehingga memperbaiki suasana hati. Hal ini dapat menyebabkan perubahan untuk sementara yang dapat meningkatkan reaksi tubuh pada situasi yang menimbulkan rasa stres. Berlari telah terbukti untuk membantu seseorang mendapatkan jadwal tidur yang normal. Hal ini disebabkan bahan kimia yang dilepaskan selama dan setelah berlari membuat tubuh menjadi lebih rileks, sehingga tidur dapat lebih nyenyak. Selain itu, tubuh yang lelah berusaha untuk mengembalikan kekuatannya, sehingga kamu masuk dalam metode “deep sleep”. Dengan memiliki jadwal tidur yang teratur, sangat baik untuk otak dan kesehatan mental. Lari dapat meningkatkan kekuatan otak dengan cara membuat sel-sel otak baru dan meningkatkan kinerja otak secara keseluruhan. Saat melakukan lari yang berat, kadar protein yang dapat membantu untuk pengambilan keputusan, serta pemikiran dan pembelajaran yang lebih cepat dihasilkan. Maka dari itu, pastikan terus meningkatkan beban dari olahraga lari agar kesehatan mental tetap terjaga. Jika kamu sudah mengalami gangguan mental, lari dapat membantu tubuh untuk lebih cepat pulih dari masalah ini. Disebutkan jika seseorang berlari secara teratur, efek yang dihasilkan sama seperti obat untuk meredakan gejala kecemasan dan depresi. Olahraga ini dianjurkan untuk dilakukan selama terapi dan pemulihan untuk meringankan gejala yang dapat timbul akibat penyakit mental Itulah beberapa manfaat dari olahraga lari pada kesehatan mental. Maka dari itu, ada baiknya untuk melakukan aktivitas fisik ini secara rutin agar mental kamu tetap terjaga dan tidak mudah terganggu. Kamu bisa mendapatkan dua manfaat sekaligus saat berlari, baik secara fisik dan juga mental. Cobalah mulai dengan perlahan jika kamu belum terbiasa melakukannya."
