Judul_Artikel,,,Link_Artikel,,,,,,Isi_Artikel
5 Tips Menjaga Kesehatan Mental Ibu Rumah Tangga,,,https://www.halodoc.com/artikel/5-tips-menjaga-kesehatan-mental-ibu-rumah-tangga,,,,,,"Kesehatan mental ibu rumah tangga adalah hal yang perlu dijaga. Pasalnya, ibu rumah tangga alias stay at home mom merupakan kelompok yang paling rentan mengalami masalah pada kesehatan mental. Bahkan, ada penelitian yang menyebut bahwa banyak ibu rumah tangga yang kemudian didiagnosa dengan depresi. Pada umumnya, ibu rumah tangga menghabiskan hampir seluruh waktu di rumah dan melakukan pekerjaan-pekerjaan domestik, seperti mengurus anak, membersihkan rumah, hingga memasak. Pekerjaan yang dilakukan secara berulang-ulang ditambah faktor-faktor lainnya bisa menjadi penyebab meningkatnya risiko masalah kesehatan mental. Ibu adalah fondasi utama dalam sebuah rumah. Hal tersebut bukanlah bualan belaka. Maka dari itu, menjaga kesehatan mental adalah hal yang penting dilakukan, terlebih pada full mom alias ibu rumah tangga. Dengan kesehatan mental yang terjaga, kestabilan rumah tangga dan hal-hal lain yang berkaitan dengan Kerjasama di rumah tentu akan berlangsung dengan lebih lancar. Ibu rumah tangga disebut lebih rentan mengalami masalah kesehatan mental, terutama depresi. Untuk menurunkan risikonya, ada beberapa tips menjaga kesehatan mental ibu yang bisa mulai dicoba untuk diterapkan, antara lain: Ibu rumah tangga akan melakukan pekerjaan yang sama setiap hari. Namun, ada baiknya untuk tetap membuat jadwal kegiatan harian, dan lakukanlah setiap kegiatan sesuai dengan jadwal yang sudah dibuat. Misalnya, bangun pagi pukul 07.00 dilanjutkan dengan sarapan sampai jam 08.00, baru setelah itu mulai mengurus anak atau pekerjaan-pekerjaan lain. Kerjaan setiap tugas pada waktu yang konsisten sehingga terasa lebih mudah. Hal ini juga penting untuk mengukur “jam kerja” ibu rumah tangga, sehingga bisa diimbangi dengan istirahat yang cukup. Faktanya, ibu rumah tangga juga butuh istirahat dan hal ini nantinya akan berkaitan dengan kondisi kesehatan mental serta kesehatan fisik. Ibu rumah tangga disarankan untuk mendapatkan tidur setidaknya 8 jam sehari. Jika tidak bisa dipenuhi pada malam hari, coba bagi dengan mengambil waktu 1–2 jam tidur siang, ketika pekerjaan pada waktu tersebut sudah selesai. Stay at home mom bukan berarti tidak bisa jalan-jalan keluar rumah. Faktanya, ibu bisa tetap pergi keluar dan mencuri waktu untuk refreshing, misalnya saat perjalanan belanja ke pasar atau sekadar mengajak anak-anak bermain di taman pada sore hari. Waktu tersebut bisa ibu manfaatkan untuk merelaksasi tubuh dan pikiran sehingga kesehatan mental lebih terjaga. Jalan-jalan sore, meskipun cuma sebentar, juga bisa dimanfaatkan untuk mencari teman sesama ibu-ibu, bercengkrama, dan saling melepas penat. Bisa jadi, gaya hidup yang diterapkan juga menjadi risiko meningkatnya gangguan kesehatan mental. Coba ingat-ingat lagi, apakah ibu sudah cukup makan sehat, cukup tidur, dan cukup berolahraga? Jika terlalu belum cukup, coba mulai untuk melakukan perubahan gaya hidup bersama dengan anak dan anggota keluarga lainnya. Jika ibu benar-benar merasa lelah dan butuh istirahat, jangan sungkan untuk berbicara pada pasangan. Jika memungkinkan, mintalah suami untuk bergantian melakukan pekerjaan rumah di hari liburnya, atau menjaga anak pada malam hari setelah pulang bekerja. Dengan begitu, ibu bisa memiliki sedikit waktu untuk memanjakan diri dan memelihara kesehatan mental. "
Cek Fakta: Peran Kakek Nenek dalam Menjaga Kesehatan Mental Anak,,,https://www.halodoc.com/artikel/cek-fakta-peran-kakek-nenek-dalam-menjaga-kesehatan-mental-anak,,,,,,"Tidak terasa liburan Natal dan Tahun Baru sudah hampir di depan mata. Apakah kamu sudah punya rencana menyambut liburan kali ini? Pulang kampung dan berkumpul dengan keluarga adalah momen yang biasanya ditunggu-tunggu saat liburan. Buat orangtua, liburan bisa digunakan sebagai momen untuk membangun kedekatan cucu dan kakek-neneknya. Menurut penelitian, kedekatan antara cucu dan kakek nenek bisa menjaga kesehatan mental anak selama masa pertumbuhan anak. Yuk, simak faktanya di sini! Sebuah studi klasik yang dilakukan oleh profesor Stewart Friedman dan Jeff Greenhaus menunjukkan durasi yang dihabiskan oleh orangtua bukanlah tolok ukur yang baik untuk kesehatan fisik dan emosional anak-anak. Sebaliknya, tolok ukur yang sebenarnya adalah kesediaan orangtua menghabiskan waktu bersama anak-anaknya. Waktu dan perhatian bukanlah hal yang sama. Ada perbedaan mendasar antara kehadiran fisik dan psikologis. Walaupun secara fisik orangtua menghabiskan banyak waktu bersama anak, jika secara psikologis tidak, itu sama saja dengan tidak hadir untuk anak. “Kekosongan” ini akan terbantu dengan adanya kehadiran kakek dan nenek. Dalam studi yang dilakukan oleh tim peneliti dari Universitas Brigham Young pada 2011, menyebutkan anak-anak yang tinggal dengan kedua orangtua ataupun single parent dan juga dekat dengan kakek atau neneknya menunjukkan perilaku sosial yang lebih baik. Perilaku sosial ini adalah saling membantu, berbagi, mau bekerja sama dan lain-lain. Kakek dan nenek cenderung senang mengajarkan keterampilan baru untuk para cucu yang berguna untuk mereka gunakan sehari-hari. Misalnya bagaimana seharusnya memperlakukan orang lain serta adab-adab yang sifatnya menghargai kehidupan dengan lebih baik. Sejatinya kedekatan kakek nenek dengan cucu dapat memperkuat hubungan emosional, sehingga ketika beranjak dewasa anak akan lebih peka terhadap lingkungan serta memiliki kenangan manis. Kedekatan antara kakek nenek dan cucu juga membantu melatih kesabaran dan tahu cara memperlakukan orang dari segala rentang usia. Dengan begitu, secara tidak langsung ini membentuk kepribadian dan mental anak lebih baik dan matang secara psikologis. Sebenarnya, tidak hanya anak saja yang mendapatkan manfaat dari hubungan yang baik dengan kakek neneknya, orangtua dan kakek nenek sendiri juga mendapatkan manfaat. Apa sajakah itu? Orangtua tahu bahwa anak-anak mereka bersama orang-orang yang mencintai mereka dan memberi mereka waktu perhatian yang tidak dapat dilakukan orangtua saat mereka sedang bekerja. Menjaga cucu dapat membuat kakek dan nenek tetap aktif dan bugar. Sedikit banyak, ini dapat membantu meningkatkan kualitas kesehatan mereka. Relasi antara kakek-nenek dan cucu-cucu memainkan peran penting dalam kesehatan satu sama lain, termasuk kesejahteraan mental keduanya."
Cara Menjaga Kesehatan Mental di Lingkungan Kerja,,,https://www.halodoc.com/artikel/cara-menjaga-kesehatan-mental-di-lingkungan-kerja,,,,,,"Meski begitu, lingkungan kerja juga memainkan peran terhadap kesehatan mental. Mudahnya, lingkungan kerja yang tidak sehat tentu akan membuat kesehatan mental tidak baik. Inilah mengapa, saat bekerja, kamu tetap perlu memperhatikan kondisi kesehatan mental diri sendiri. Jangan sampai pekerjaan membuat kamu terbebani secara psikis. Lalu, bagaimana sebenarnya cara menjaga kesehatan mental saat sedang berada di lingkungan kerja? Beberapa cara berikut ini bisa kamu coba Mengutarakan apa yang kamu rasakan bisa membantu menjaga kesehatan mental sekaligus menghadapi ketika kamu sedang mengalami masalah di kantor. Membicarakan perasaan bukan berarti kamu lemah. Jika dirasa sulit, kamu bisa bercerita pada teman, keluarga, atau pasangan. Ini akan membantu mengurangi beban yang kamu rasakan. Rutin berolahraga bisa membantu meningkatkan rasa percaya diri dan fokus, tidur menjadi lebih nyenyak, dan fisik merasa jauh lebih segar. Tidak harus mengunjungi pusat kebugaran, cukup berolahraga ringan selama sekitar 30 menit setiap hari sudah cukup. Apabila bekerja di kantor, kamu bisa meluangkan waktu untuk sekadar berjalan-jalan keluar atau mengikuti kelas khusus ketika jam makan siang. Berolahraga sebelum atau sesudah bekerja bisa membuat kamu lebih baik mengatur waktu, lho! Makanan yang kamu konsumsi bisa memengaruhi suasana hati, baik secara langsung maupun nanti. Jadi, sebisa mungkin terapkan pola makan sehat dan bergizi untuk menunjang kesehatan fisik dan mentalmu. Luangkan waktu untuk mengisi perut, sediakan camilan sehat untuk kamu konsumsi di antara waktu makan. Tidak boleh lupa, pastikan tubuh mendapatkan cukup istirahat, terutama pada malam hari. Hindari begadang supaya tubuh bisa lebih fit dan segar esok hari. Begadang hanya akan membuat kamu tidak bisa fokus dan mengantuk, bahkan rentan mengalami sakit kepala. Tidak ada salahnya untuk mengambil cuti. Manfaatkan untuk mengisi kembali tenaga. Bepergian ke tempat yang kamu suka atau sekadar menghabiskan waktu sendiri tanpa terganggu pekerjaan. Ini tentu saja sangat baik untuk menjaga mental tetap sehat. "
Pentingnya Merayakan Hari Pahlawan bagi Kesehatan Mental,,,https://www.halodoc.com/artikel/pentingnya-merayakan-hari-pahlawan-bagi-kesehatan-mental,,,,,,"Hidup aman dan nyaman yang kamu jalani hari ini, bisa jadi merupakan hasil perjuangan para pahlawan di masa lalu. Itulah sebabnya, penting untuk turut merayakan hari Pahlawan, yang jatuh pada 10 November setiap tahunnya. Merayakan hari Pahlawan bukan hanya sekadar selebrasi. Menurut Defryansyah Amin, M.Psi., psikolog yang juga founder dari Aditi Psychological Center, memaknai hari Pahlawan juga bisa bermanfaat bagi kesehatan mental. Ketika membaca kisah para pahlawan di buku sejarah, sosok pahlawan digambarkan sebagai orang yang bisa memberi harapan di tengah kegentingan. Secara psikologis, memiliki harapan yang positif sangatlah penting dan dibutuhkan bagi kesehatan mental dan juga fisik. “Harapan yang positif dapat memengaruhi produktivitas dan tingkat kerentanan seseorang untuk memiliki gangguan kecemasan atau depresi. Semakin tinggi harapan yang dimiliki, semakin rendah pula kemungkinan seseorang mengalami depresi ataupun gangguan kecemasan,” kata Defryansyah dalam wawancara eksklusif bersama Halodoc. Ia pun menambahkan, apabila seseorang merasa memiliki suatu harapan dan tidak membiarkan dirinya tenggelam dalam emosi dan pikiran negatif, ia akan menjadi lebih fokus terhadap harapannya. Ini secara tidak langsung akan membuat mereka lebih fokus dalam merawat diri serta melakukan kebiasaan-kebiasaan positif yang dapat membuat dirinya hidup lebih sehat baik secara fisik maupun psikis. Ditetapkannya 10 November sebagai hari Pahlawan bukanlah tanpa alasan. Hari besar ini ditetapkan oleh Presiden Sukarno, untuk menghormati pahlawan yang gugur di medan pertempuran pada 10 November 1945, di Surabaya.Salah satu cara untuk memperingati dan memaknai hari Pahlawan adalah dengan membaca kisah-kisahnya. Ternyata, membaca kisah para pahlawan di masa lalu juga bermanfaat bagi kesehatan mental, lho. Mengutip laman Psychology Today, kisah-kisah pahlawan dapat menenangkan ketakutan, sekaligus menyembuhkan luka batin seseorang. Sebab, aksi heroik dan pengorbanan para pahlawan dapat membantu seseorang memelihara harapan dan memupuk nilai-nilai penting kekuatan dan ketahanan. Keberanian dan semangat para pahlawan di masa lalu bisa menginspirasi seseorang untuk juga bersemangat menjalani kehidupan. Menurut Defryansyah, keberanian dan semangat pahlawan itu dapat dihayati sebagai suatu perjuangan dalam menghadapi segala sesuatu. Dengan begitu, secara tidak sadar akan timbul keyakinan bahwa seberat apapun rintangan yang dihadapi, seseorang akan mampu melewatinya. “Alhasil, kita mampu meningkatkan kepercayaan diri kita, meningkatkan optimisme, serta meningkatkan harapan-harapan kita terhadap diri sendiri maupun pencapaian tujuan di masa depan,” ujarnya. Bicara soal harapan, semangat, dan rasa percaya diri, Defryansyah juga mengungkapkan bahwa memaknai hari Pahlawan juga bisa memberi dampak positif bagi anak-anak Menurut Defryansyah, orang-orang yang memiliki harapan akan memiliki persepsi yang lebih rendah terhadap rasa sakit. Hal ini karena mereka memiliki optimisme yang secara tidak sadar dapat mengurangi sakit yang dirasakan. Nah, itulah beberapa manfaat penting dari memperingati dan memaknai hari Pahlawan bagi kesehatan mental. Dapat diketahui bahwa ternyata semangat, keberanian, dan perjuangan para pahlawan di masa lalu, dapat membantu memelihara harapan, meningkatkan semangat, hingga menyembuhkan luka. Oleh karena itu, jangan lupa untuk senantiasa merayakan semarak hari Pahlawan setiap tahunnya, serta memaknainya secara lebih mendalam. Untuk menjaga kesehatan mental, jangan lupa untuk menjaga gaya hidup sehat setiap harinya. "
Kata Psikolog: Waspada Gangguan Mental pada Lansia,,,https://www.halodoc.com/artikel/kata-psikolog-waspada-gangguan-mental-pada-lansia,,,,,,"Lansia cukup rentan mengalami gangguan mental dikarenakan salah satunya dikarenakan usia lansia mengalami penurunan kemampuan fisik dan finansial yang pada akhirnya memberikan rasa tidak berdaya, malu, dan menarik diri dari lingkungan. Depresi ini biasanya disebabkan oleh rasa tidak berdaya, tidak berharga, kehilangan minat, kehilangan harapan, dan tidak jarang juga keinginan untuk mengakhiri hidup. Kecemasan yang dialami lansia biasanya sangat berlebihan padahal hanya karena masalah sepele. Perubahan kognitif membuat lansia lebih sensitif, sehingga masalah sepele bisa menjadi sesuatu yang signifikan buatnya. Inilah yang memunculkan kecemasan berlebihan. Kondisi skizofrenia yang dialami lansia di sini bentuknya kehilangan kontak dengan dunia nyata, dimana ada kesulitan antara membedakan realita dan khayalan. Penting untuk mewaspadai gangguan mental pada lansia. Supaya jangan sampai telat penanganan ketika masalahnya sudah kompleks. Berikut ini adalah tanda-tanda peringatan kalau lansia sedang mengalami gangguan mental Penelitian telah membuktikan bahwa membaca dapat meningkatkan fungsi memori, mengurangi stres dan meningkatkan kualitas tidur pada lansia. Menulis jurnal juga dapat membantu mengelola dan mengurangi efek stres dan kecemasan. Latihan belajar bahasa kerap direkomendasikan oleh lansia karena dapat membangun kepercayaan diri dan meningkatkan interaksi dan sosialisasi dengan orang lain. Seperti halnya penguasaan dan pembelajaran bahasa, memainkan alat musik juga bisa meningkatkan fungsi kognitif. Musik merangsang otak dan meningkatkan memori pada manula dengan alzheimer dan demensia. Bermain musik dapat meningkatkan kelancaran verbal dan kecepatan pemrosesan sesuatu hal. Untuk pilihan lain, melakukan teka-teki telah terbukti menunda penurunan memori dan meningkatkan kesehatan mental para lansia. Tetap berhubungan dengan orang-orang terdekat juga dapat membantu mencegah kesepian dan perasaan terisolasi yang dapat menyebabkan depresi, serta penurunan mental dan fisik pada lansia. Jika kamu memiliki kerabat yang sudah lanjut usia, tetaplah menjalin komunikasi dan lakukan kunjungan rutin untuk membantu lansia tidak merasa kesepian dan terhubung dengan orang-orang yang disayanginya."
Ini Ciri-Ciri Seseorang Mengalami Gangguan Kesehatan Mental,,,https://www.halodoc.com/artikel/ini-ciri-ciri-seseorang-mengalami-gangguan-kesehatan-mental,,,,,,"Menjaga kesehatan fisik itu sama pentingnya dengan menjaga kesehatan mental. Perlu dipahami, gangguan kesehatan mental sebenarnya suatu kondisi yang umum terjadi. Sama seperti penyakit pada fisik, gangguan kesehatan mental juga perlu diatasi, agar tidak mengganggu kualitas hidup pengidapnya. Jika dijelaskan secara medis, gangguan kesehatan mental terjadi ketika keseimbangan kimiawi di otak terganggu. Akibatnya, terjadilah gangguan pada cara berpikir, bertindak, dan merasakan sesuatu, serta cara memandang segala sesuatu dalam kehidupan. Lantas, bagaimana ciri seseorang yang mengalami gangguan kesehatan mental? Sebenarnya, jika berbicara mengenai gangguan kesehatan mental, jenisnya ada banyak sekali. Beberapa yang umum terjadi adalah depresi, gangguan bipolar, gangguan kecemasan, PTSD, OCD, dan psikosis. Ada jenis gangguan kesehatan mental yang hanya terjadi pada suatu kelompok orang, misalnya postpartum depression yang hanya terjadi pada wanita setelah melahirkan. Meski jenisnya banyak, ada beberapa gejala umum yang dialami seseorang yang mengalami gangguan kesehatan mental. Gangguan kesehatan mental juga bisa memengaruhi kesehatan fisik. Itulah sebabnya orang dengan gangguan kesehatan mental sering mengeluhkan gejala yang mengganggu kehidupan dan pekerjaan mereka. Gejala tersebut berupa perubahan suasana hati, kepribadian, kebiasaan, dan penarikan diri dari lingkungan sosial. Sebenarnya, hampir setiap gangguan kesehatan mental tidak bisa diketahui penyebabnya secara pasti. Berbeda dengan penyakit fisik, gangguan kesehatan mental bisa terjadi karena berbagai faktor atau kombinasinya. Namun, secara umum, berikut ini hal yang bisa jadi faktor pemicu gangguan kesehatan mental: Untuk mengetahui apa penyebab pasti dari gangguan kesehatan mental yang dialami, dibutuhkan konseling lebih lanjut dengan psikolog atau psikiater. Jadi, jangan takut meminta bantuan profesional, jika mengalami gejala gangguan kesehatan mental. Perawatan dan pengobatan yang tepat dapat membuat gangguan mental yang dialami dapat sembuh dengan cepat. Meski ada juga beberapa orang yang membutuhkan waktu sedikit lebih lama untuk pulih. Namun, semakin cepat gejala gangguan kesehatan mental disadari dan diobati, peluang untuk sembuh pun akan cukup besar. "
Merayakan Sumpah Pemuda dengan Sadar Kesehatan Mental,,,https://www.halodoc.com/artikel/merayakan-sumpah-pemuda-dengan-sadar-kesehatan-mental,,,,,,"Setiap tanggal 28 Oktober, Sumpah Pemuda mengingatkan akan pentingnya peran anak muda dalam memajukan bangsa. Bertepatan dengan tanggal 28 Oktober yang akan datang, alangkah baiknya juga sekaligus menjadi pengingat mengenai pentingnya kesadaran akan kesehatan mental. Meningkatkan kesadaran kesehatan mental dapat membantu kamu memahami gejala, menemukan perawatan profesional, dan yang paling penting adalah mematahkan stigma kesehatan mental yang salah. Yuk, simak di sini apa saja yang perlu diperhatikan untuk meningkatkan kesadaran kesehatan mental! Tadi sudah disinggung sebelumnya betapa pentingnya meningkatkan kesadaran kesehatan mental. Ini dilakukan untuk membantu orang-orang yang mengalami gangguan kesehatan mental merasa tidak sendirian dalam perjuangan bertahan dengan kondisinya. Menerapkan pendekatan yang baik dapat meningkatkan kesadaran dan pemahaman akan pentingnya pemahaman akan kesehatan mental. Sebagai pemahaman awal, kamu perlu tahu kalau ada beberapa gangguan umum dari kesehatan mental, yaitu gangguan kecemasan, depresi, bipolar, stres pascatrauma, dan skizofrenia. Ini hanya sebagian kecil dari gangguan kesehatan mental yang ada. Perlu diketahui, walaupun kondisi gangguan kesehatan mental ini memiliki gejala yang berbeda, kondisi ini dapat memengaruhi cara berpikir, merasa, dan perilaku orang yang mengalaminya. Banyak orang yang memiliki gangguan kesehatan mental tidak yakin dengan gejalanya dan tidak tahu harus melakukan apa. Akibatnya, orang tersebut bisa mengonsumsi obat-obatan atau alkohol. Memiliki satu penyakit mental yang tidak diobati, menempatkan seseorang pada risiko mengembangkan gangguan lain yang bila terjadi secara bersamaan memerlukan perawatan yang lebih kompleks lagi. Nah, kalau kamu mencurigai kamu mengalami gangguan kesehatan mental, jangan ditunda lagi, segera hubungi psikolog atau psikiater di Halodoc untuk mendapatkan penanganan yang tepat! Gejala orang yang mengalami gangguan kesehatan mental bisa beragam, sebagai gambaran untuk mewaspadai, berikut ini adalah gejala yang biasa dialami: Perasaan sedih adalah suatu hal yang biasa dialami. Namun, bila akhir-akhir ini kamu sering mengalaminya, kamu patut curiga kalau kesedihan yang kamu rasakan bukanlah kesedihan biasa. Tidak bersemangat dan kehilangan konsentrasi adalah tanda-tanda lain dari orang yang mengalami gangguan kesehatan mental. Terutama jika sampai mengganggu aktivitas pekerjaannya. Ketakutan atau kekhawatiran yang berlebihan serta perasaan bersalah yang ekstrem juga menjadi tanda seseorang mengalami gangguan kesehatan mental. Pernahkah kamu mengalami perubahan suasana hati yang ekstrem? Tiba-tiba marah, enggak berapa lama kemudian merasa senang? Ini bisa menjadi tanda kalau kamu mengalami gangguan kesehatan mental. Sestres apapun orang bila bersama dengan teman-temannya, dia akan mendapatkan penghiburan. Begitu juga dengan aktivitas favorit adalah pelipur lara ketika sedang suntuk ataupun tidak bersemangat. Bagaimana bila hal-hal yang dulunya menyenangkan menjadi tidak menyenangkan? Ini bisa menjadi tanda-tanda kalau seseorang sedang tidak baik-baik saja. Cepat merasa lelah juga menjadi indikasi kalau seseorang sedang mengalami gangguan kesehatan. Tidur yang dilakukan terus-menerus serta tidak bergairah untuk melakukan apapun karena merasa badan cepat letih adalah pertanda kalau ada yang tidak beres dengan kondisi fisik dan mentalmu. "
Cek Fakta: Menikah Lebih Baik untuk Kesehatan Mental Pria,,,https://www.halodoc.com/artikel/cek-fakta-menikah-lebih-baik-untuk-kesehatan-mental-pria,,,,,,"Menurut data kesehatan yang dipublikasikan oleh Harvard Health Publishing, pria yang menikah lebih sehat mentalnya daripada pria yang tidak pernah menikah atau yang pernikahannya berakhir dengan perceraian ataupun karena pasangannya meninggal. Faktor yang memicu kesehatan mental tersebut dikarenakan pria yang tidak menikah ataupun ditinggal pasangannya lebih merasa kesepian. Kesepian bisa memicu gangguan pada kesehatan mental. Yuk, simak faktanya di sini! Bagaimana menikah bisa baik untuk kesehatan mental pria? Kesehatan fisik dan mental pria mengalami peningkatan karena pengaruh positif pasangannya. Hubungan yang positif bisa meningkatkan kesehatan mental pria tetapi kegagalan hubungan juga dapat membahayakan kesehatan. Walaupun ada kemungkinan demikian, itu bukan berarti harus menghindari pernikahan. Justru ketika dalam pernikahan terjadi guncangan tetapi pasangan berhasil menyelesaikan masalah tersebut, maka hubungan keduanya akan semakin kuat. Hubungan yang kuat ini akan berdampak pada kesehatan mental. Pasangan yang sudah menikah juga dapat memperoleh keuntungan finansial. Pernikahan dapat membawa peningkatan dukungan emosional dan instrumental. Pernikahan dapat mengubah gaya hidup yang mendukung pada aktivitas yang sehat dan menurunkan perilaku berisiko. Bisa jadi ini dikarenakan adanya tanggung jawab setelah menikah yang membuat pasangan harus lebih berhati-hati dalam melakukan sesuatu dan menentukan pilihan. Ada kecenderungan orang yang sudah menikah lebih menjaga perilakunya dan mengerem hal-hal yang berpotensi mengganggu ketenteraman hubungan. Namun terkadang, hal ini tidak selalu baik. Jika pasangan memilih untuk mendiamkan dan menekan perasaannya justru malah jadi bikin mental terganggu. Jadi, ketika disebutkan menikah lebih baik untuk kesehatan mental pria, perlu digali lebih dalam faktor-faktor penentu lainnya. Misalnya seperti apakah hubungan dengan pasangan, apakah relasi pernikahan tersebut setara atau tidak, bagaimana kondisi finansial pernikahan tersebut serta hal-hal lainnya. Pastinya menikah saja tidak akan menjamin kalau kesehatan pria bisa lebih baik, tergantung seberapa berkualitas relasi pernikahan tersebut. Karena kalau ngomongin soal kesepian, ada banyak juga pasangan yang merasa kesepian walaupun sudah menikah. Ada saja pasangan yang mengalami depresi dan stres karena pasangannya terlalu mengekang. Tadi sudah disinggung kalau tidak selalu pernikahan dapat berdampak pada kesehatan mental. Cek tandanya di sini, seperti apakah tanda pernikahan yang sehat? Relasi yang baik adalah relasi dimana kamu dan pasanganmu seperti teman. Kerja tim akan membuat pernikahan berhasil. Pada akhirnya pernikahan tidak ubahnya mitra setara yang saling mendukung. Stres dalam pernikahan adalah hal yang tidak bisa dihindari. Tahu cara mengelola dan mengatasi stres dalam pernikahan adalah kunci pernikahan yang sehat. Apakah kamu merasa kebersamaan dengan pasangan adalah sesuatu yang membosankan? Bisa jadi itu tandanya pernikahanmu sedang tidak baik. Menikmati kebersamaan adalah tanda pernikahan yang sehat."
